Date,Title,Score,Sentiment,Language
2024-09-09,"Here's everything Apple just announced: iPhone 16, iPhone 16 Pro, Apple Watch Series 10, AirPods 4 and more",0.0,Neutral,English
2024-09-09,Apple announces the iPhone 16 Pro,0.0,Neutral,English
2024-09-09,"Apple's iPhone 16 to put AI features in focus, Huawei's new phone racks up pre-orders",0.795109212398529,Positive,English
2024-09-09,Huawei's tri-fold phone gets 2.7 million pre-orders ahead of Apple's iPhone 16 launch,0.6776466965675354,Positive,English
2024-09-08,Apple’s new iPhone will use Arm’s next-generation chip technology for AI,0.0,Neutral,English
2024-09-05,"Microsoft Slams Apple’s 30% Fee, Calls it a Barrier for Xbox Cloud Gaming on iOS ",-0.8617085814476013,Negative,English
2024-09-04,"Expectations from iPhone 16 keynote, India’s tablet market and OpenAI investment",0.526340126991272,Positive,English
2024-09-03,"Apple to switch to OLED displays for all upcoming iPhones from 2025, Nikkei reports",0.0,Neutral,English
2024-09-02,Huawei Plans Tri-Fold Smartphone Launch to Counter Apple’s iPhone 16 Reveal,0.5876064300537109,Positive,English
2024-08-31,"Apple Phone 16, iPhone 16 Pro Release Date Schedule: Your Complete Countdown",0.0,Neutral,English
2024-08-30,Spotify says Apple 'discontinued' the tech for some of its volume controls on iOS,-0.9297036528587341,Negative,English
2024-08-28,How the Pentagon built Silicon Valley : The increasingly close-knit relationship the tech industry enjoys with the Defense Department is not a sudden development,0.0,Neutral,English
2024-08-28,"Tech Industry Uses Push Poll to Stop California AI Bill | The legislation is likely to pass, but Gov. Gavin Newsom is being lobbied hard by Silicon Valley to oppose it, using what can be seen as deceptive tactics.",-0.8056840896606445,Negative,English
2024-08-28,Silicon Valley’s Very Online Ideologues are in Model Collapse,0.0,Neutral,English
2024-08-28,Google’s Pixels are simpler than the iPhone now,0.0,Neutral,English
2024-08-26,California AI bill sparks debate in Silicon Valley as some tech giants call it a threat to innovation,-0.7529634237289429,Negative,English
2024-08-23,EU iPhones will be able to change the default phone and messaging apps soon | Apple will let users easily set new default keyboard and password managers or even delete the App Store app.,0.0,Neutral,English
2024-08-21,iOS bug causes iPhone to crash when you type these four characters,-0.8097805380821228,Negative,English
2024-08-20,World’s largest iPhone factory loses momentum amid supply chain diversification away from China,-0.9676758646965027,Negative,English
2024-08-19,"iPhone challenger Nothing calls staff back in 5 days a week, threatening dissenters with dismissal",-0.9189178347587585,Negative,English
2024-08-16,Fortnite is back on the iPhone — with a whole app store in tow,0.0,Neutral,English
2024-08-15,Apple iPhone 16 Pro: Everything We Know So Far,0.0,Neutral,English
2024-08-15,iPhones will help decide offside violations in English soccer this season,0.0,Neutral,English
2024-08-14,Apple is finally going to open up iPhone tap-to-pay,0.0,Neutral,English
2024-08-14,Apple finally allows Spotify to show pricing info to EU users on iOS,0.0,Neutral,English
2024-08-13,"Google debuts Pixel smartphone lineup, including a new foldable phone, ahead of Apple's latest iPhone push",0.0,Neutral,English
2024-08-06,"Satellite Operators to Boost IoT Growth with 15,000 New Satellites in Next 5 Years",0.9431283473968506,Positive,English
2024-08-06,iOS 18 has fulfilled my dream of destroying ads with a Thanos snap,0.0,Neutral,English
2024-08-05,"Apple Intelligence is falling for phishing emails, and that could cost iPhone users | The AI-powered filter is prioritizing scam emails instead of discarding them.",-0.8775359392166138,Negative,English
2024-08-03,Nvidia: Tech stocks take a pounding as hedge fund Elliott warns AI is in ‘bubble land’,-0.8804325461387634,Negative,English
2024-08-02,"Your heartbeat could soon unlock an iPhone, new patent shows",0.0,Neutral,English
2024-08-01,Apple reports record revenues despite stagnant iPhone sales,0.9406267404556274,Positive,French
2024-08-01,"Microsoft strips ads from Skype in a move toward “user-centric design” | Update also improves AI image features, adds OneAuth support on iOS",0.551206648349762,Positive,English
2024-07-30,It only took the iPhone 17 years to support call recording,0.0,Neutral,English
2024-07-29,iOS 18.1 developer beta brings Apple Intelligence into the wild for the first time,0.0,Neutral,English
2024-07-29,The Top New Features Coming to Apple’s iOS 18 and iPadOS 18,0.0,Neutral,English
2024-07-29,Apple releases first preview of its long-awaited iPhone AI,0.0,Neutral,English
2024-07-29,"Apple will reportedly release artificial intelligence features in October, weeks after iOS 18 update",0.0,Neutral,English
2024-07-28,Apple Intelligence to miss initial launch of upcoming iOS 18 overhaul,-0.9218083620071411,Negative,English
2024-07-26,"Here's why David Sacks, Paul Graham and other big Silicon Valley names had a brawl on X over VC behavior",0.0,Neutral,English
2024-07-25,"You can install Windows 11 on an iPhone, but you probably don’t want to",0.0,Neutral,English
2024-07-24,"Huawei plans tri-fold smartphone as Apple weighs foldable iPhone, reports say",0.0,Neutral,English
2024-07-24,iPhone torrenting apps are now available in the EU,0.0,Neutral,English
2024-07-24,"We experimented with macOS on the iPad, and it was surprisingly good",0.0,Neutral,English
2024-07-24,"A Silicon Valley executive had $400,000 stolen by cybercriminals while buying a home. Here’s her warning",0.0,Neutral,English
2024-07-22,"As new tech threatens jobs, Silicon Valley promotes no-strings cash aid",0.0,Neutral,English
2024-07-16,"Without Apple Intelligence, iOS 18 beta feels like a TV show that’s waiting for the finale",0.0,Neutral,English
2024-07-15,"First PC emulator arrives on iOS App Store, delivers i486 or PowerPC fun on your iPhone, iPad or Vision Pro | Play Doom on your iPhone just like you did on your 486 decades ago.",0.0,Neutral,English
2024-07-13,"After initially rejecting it, Apple has approved the first PC emulator for iOS",0.7362756729125977,Positive,English
2024-07-09,Google Messages better get this fix before iPhone RCS support rolls out,0.0,Neutral,English
2024-07-08,Microsoft Orders China Staff to Use iPhones for Work and Drop Android,-0.9334509372711182,Negative,English
2024-07-08,"Microsoft bans China-based employees from using Android devices for work, mandates switch to iPhones | Part of Microsoft's global security push",-0.7211276292800903,Negative,English
2024-07-08,"After iPhone Success, Apple Wants To Revive Its 'Make In India' Plans For iPads And AirPod Cases: Report",0.49683865904808044,Positive,English
2024-12-27,I need help!,0.0,Neutral,English
2024-12-18,LLC SETUP,0.0,Neutral,English
2024-12-16,The power of prototyping,0.0,Neutral,English
2024-12-12,"My Neat Scanner no longer works...can I just take pictures of all my receipts, invoices, packing slips?",0.0,Neutral,English
2024-12-09,"Why is no one buying my app for $0.49, but when it was for free I got 1.8k downloads in a week?",0.0,Neutral,English
2024-12-08,PSA: Never get AAA,-0.9284690022468567,Negative,English
2024-11-24,How I Would Raise Money to Start a Business?,0.0,Neutral,English
2024-11-23,Driving School,0.0,Neutral,English
2024-11-21,"New SaaS - Scrape Leads, Draft Personalized DMs, Create B2B Sales Pages and track them.",0.0,Neutral,English
2024-11-12,idea,0.0,Neutral,English
2024-11-11,A problem in one of my business textbooks.,0.0,Neutral,English
2024-11-07,Best Way to Convey To Bro That It's Not All Because of Him,0.0,Neutral,English
2024-11-07,Container shipping company? ,0.0,Neutral,English
2024-11-05,Am I being scammed?! ,0.0,Neutral,English
2024-11-05,How should I improve my safety device?,0.0,Neutral,English
2024-11-02,Mileage Tracking Focused Phone,0.0,Neutral,English
2024-11-01,Is it possible to make a device that makes your phone text contacts?,0.0,Neutral,English
2024-10-30,Don't Know What I Don't Know,0.0,Neutral,English
2024-10-28,Needing some software for a lawn care business. ,0.0,Neutral,English
2024-10-22,Do coupons bring profits to company by gaining long-term customers despite losing money on the initial purchase in which said coupon is used?,0.0,Neutral,English
2024-10-21,Why I stopped starting businesses with partners and why you should too.,0.0,Neutral,English
2024-10-20,Why do things never work out for me. Need Advice for 19yo boy from India.,0.0,Neutral,English
2024-10-18,How to sell mobile app?,0.0,Neutral,English
2024-10-18,Have Google ads destroyed organic results now?,0.0,Neutral,English
2024-10-09,Retirement ,0.0,Neutral,English
2024-10-07,Looking to Split the Cost of ZoomInfo or Purchase an Existing License,0.0,Neutral,English
2024-10-07,Roofing business,0.0,Neutral,English
2024-10-01,"More and more elderly getting scammed... There has to be a solution (and a sustainable business with it)
",0.0,Neutral,English
2024-09-30,Arrogant CEO Decisions That Backfired: Let’s Build the Ultimate List,-0.915350615978241,Negative,English
2024-09-30,Fix commingled funds or start fresh? ,0.0,Neutral,English
2024-09-21,"Do you use a customer portal for client communication? If not, how do you manage it?",0.0,Neutral,English
2024-09-16,Creating backlink profile. Where to get email contacts database?,0.0,Neutral,English
2024-09-10,Need help with choosing the right billing system.,0.0,Neutral,English
2024-09-09,"If you don't hate it, you'll eventually tolerate it- Malcolm X",0.0,Neutral,English
2024-09-09,Struggling to Manage Multiple WhatsApp Contacts—Any Tips for Staying Organized?,0.0,Neutral,English
2024-09-08,"I'm making art and am looking to put it on merchandise, is there a company/business that can help with this? ",0.0,Neutral,English
2024-09-05,TextNow for Business ,0.0,Neutral,English
2024-09-01,Opening a U.S. Bank account for foreign businesses,0.0,Neutral,English
2024-08-31,Developed a SaaS MVP and I have no idea how to validate it?,0.0,Neutral,English
2024-08-27,What are some real industry problems?,0.0,Neutral,English
2024-08-23,Dad might want to buy a business and put our house on the line (a bigger lean),0.0,Neutral,English
2024-08-23,'The time has come' to lower interest rates: Fed Chair Jerome Powell,0.0,Neutral,English
2024-08-15,Coming to ‘iPhone City’: An Electric Car Factory From Foxconn,0.0,Neutral,English
2024-08-15,Adding Information for Further Conversation,0.0,Neutral,English
2024-08-12,Best laptops for business majors,0.0,Neutral,English
2024-08-08,iOS products and revenue,0.0,Neutral,English
2024-08-06,Best Alternatives to Escrow.com?,0.0,Neutral,English
2024-08-04,Apple Intelligence Has a Long Way to Go to Match Its Marketing Hype  ,0.0,Neutral,English
2024-08-03,Warren Buffet's Berkshire Hathaway sells half its Apple stock,0.0,Neutral,English
2024-08-03,Facebook advertising dead ?,0.0,Neutral,English
2024-08-02,Going into a business debt,0.0,Neutral,English
2024-07-30,A Blind Association asked me for a discount to create them a video.,0.0,Neutral,English
2024-07-24,How to run meta ads for ANY business in 2024,0.0,Neutral,English
2024-07-23,Business and Tax structure for a company that does a thousand unrelated things?,0.0,Neutral,English
2024-07-18,What we think customers want Vs what customers actually want,0.0,Neutral,English
2024-07-16,"Question: Have you had customers leave you for your competition? If yes, why?",0.0,Neutral,English
2024-07-12,S- corporation partnership,0.0,Neutral,English
2024-07-12,Self Made CEO High Stress Extreme Pressure- Any Advice?,0.0,Neutral,English
2024-07-11,"Pivots: Should businesses pivot their business offering? If yes, when and how many times?",0.0,Neutral,English
2024-07-09,Best way to request and collect money from clients without losing money over transaction fees? ,0.0,Neutral,English
2024-07-04,"I was thinking about building something, but for that I need the answer before.

Where are you last third trip's pictures? Lost in your phone gallery somewhere or some kid deleted it accidentally?",0.0,Neutral,English
2024-07-03,google review,0.0,Neutral,English
2024-06-25,Starting a mobile tech support side hustle,0.0,Neutral,English
2024-06-24,Industries to consider?,0.0,Neutral,English
2024-06-19,What's the best website builder when you offer a service and not a product?,0.0,Neutral,English
2024-06-13,How to handle scheduling and massive amounts of texts,-0.7082304358482361,Negative,English
2024-06-13,Am I irresponsible ?,-0.639671266078949,Negative,English
2024-06-10,Apple Intelligence Will Infuse the iPhone With Generative AI,0.0,Neutral,English
2024-06-06,Looking for accurate data for B2B Sales,0.0,Neutral,English
2024-06-06,The Lords of Silicon Valley Are Thrilled to Present a ‘Handheld Iron Dome’,0.0,Neutral,English
2024-05-29,I've Inherited A Failing Business,0.0,Neutral,English
2024-05-26,Why do some businesses refuse CNP transactions (manually entering a card number) in-store but accept them online?,0.0,Neutral,English
2024-05-25,Finding a mentor,0.0,Neutral,English
2024-05-20,The End of ‘iPhone’,0.0,Neutral,English
2024-05-17,Struggling business help,0.0,Neutral,English
2024-05-14,How to Implement Call Routing Options for Job Seekers and Clients? ,0.0,Neutral,English
2024-05-06,B2B Marketing,0.0,Neutral,English
2024-05-04,Which path to go with at 19?,0.0,Neutral,English
2024-05-03,Would You Still Use Google if It Didn't Pay Apple $20 Billion to Get on Your iPhone?,0.0,Neutral,English
2024-05-03,"Apple’s Q2 2024 earnings reveal a drop in iPhone, iPad sales",-0.9733192920684814,Negative,English
2024-04-25,Pitching PR Idea to Employer,0.0,Neutral,English
2024-04-24,Is it okay to quit your job for a smaller company?,0.0,Neutral,English
2024-04-17,"All the pieces for buying the business are there, but I'm poor.",0.0,Neutral,English
2024-04-11,Apple doubles India iPhone production to $14 billion as it shifts from China,0.931304395198822,Positive,English
2024-04-10,New startup and my partner is trying to rip me off already,0.0,Neutral,English
2024-04-08,The wholesale house - twhouse,0.0,Neutral,English
2024-04-08,"Okay, career crossroads here – need some advice...",0.0,Neutral,English
2024-04-06,Licensed Painter looking for best place(s) to spend starting budget on advertising,0.0,Neutral,English
2024-04-06,"Okay, help me out with Brazil – taxes are nuts there?",0.0,Neutral,English
2024-04-03,A company has just registered the same name as me. ,0.0,Neutral,English
2024-03-21,CNBC: DOJ sues Apple over iPhone monopoly in landmark antitrust case,-0.9267379641532898,Negative,English
2024-03-15,Apple Agrees to Pay $490M to Settle Lawsuit Alleging That Tim Cook Defrauded Shareholders,-0.44660526514053345,Negative,English
2024-03-11,Does anyone else have tons of notes everywhere? Think I've found a solution!,0.0,Neutral,English
2024-03-05,"Apple iPhone sales plunge 24% in China as Huawei smartphone business resurges, report says",-0.9662821888923645,Negative,English
2024-03-05,SMS restrictions in the US,0.0,Neutral,English
2024-02-28,"Inherited a Business, How To Sell?",0.0,Neutral,English
2024-02-26,Questions for a business owner,0.0,Neutral,English
2024-02-26,'Burn Book' torches tech titans in veteran reporter's tale of love and loathing in Silicon Valley,0.0,Neutral,English
2024-02-25,Where to find investors?,0.0,Neutral,English
2024-02-25,Need to ask a business owner these questions for school,0.0,Neutral,English
2024-02-24,Need to interview a business owner for a school assignment,0.0,Neutral,English
2024-02-18,QR Code vs NFC,0.0,Neutral,English
2024-02-16,Developer submits crazy expensive bid and then reduces it by 80%?,0.0,Neutral,English
2024-02-08,Wanting to start a business,0.0,Neutral,English
2024-01-31,Can anybody help me to find a way to become a CEO of a Fortune 500 company?,0.0,Neutral,English
2024-01-29,Apple vs Google appa,0.0,Neutral,English
2024-01-25,"Apple announces changes to iOS, Safari, and the App Store in the European Union",0.0,Neutral,English
2024-01-23,"2024 Google My Business how to rank study. If you have a GMB, do this!",0.0,Neutral,English
2024-01-22,Looking for leadership online courses and/or book recommendations,0.0,Neutral,English
2024-01-19,Apple offers to open iPhone NFC payments to third-party providers after EU investigation,0.0,Neutral,English
2024-01-15,Apple offers rare iPhone discount in China as demand fears rise,-0.5372099876403809,Negative,English
2024-01-14,"After big tech layoffs, Silicon Valley may have lost its monopoly on workers",-0.8808795213699341,Negative,English
2024-01-11,Al Gore To Leave Apple Board After 21-Year Run; Company Reveals CEO Tim Cook’s Pay Dropped 36% In 2023 After Shareholder Pressure,-0.9676111340522766,Negative,English
2024-01-08,Bonified Recommendations for Delware LLC Agent services,0.0,Neutral,English
2024-01-06,Employee management help?,0.0,Neutral,English
2024-01-02,Apple shares slip nearly 3% after Barclays downgrade,-0.9668542146682739,Negative,English
2024-12-31,Technologies for a New Era and Abundance,0.0,Neutral,English
2024-12-21,Only Prediction for 2025: Advancement in IPhones.,0.0,Neutral,English
2024-12-18,We need to ditch smart phones to benefit scientific discovery. Smart phones are a catch-22 and it's dumbing us down! ,-0.933222234249115,Negative,English
2024-12-17,What will be the next computing device that will disrupt the phone...if even the phone can be disrupted?,0.0,Neutral,English
2024-12-12,Streaming video games is the future of online gaming. ,0.0,Neutral,English
2024-12-08,Will Elon Musk succeed in taking over the internet and telecommunications in general?,0.0,Neutral,English
2024-11-27,"Life extension is seemingly getting mainstream news coverage, and not in a positive light. Thoughts?",0.0,Neutral,English
2024-11-27,"Our governing elites are leading us over a cliff - Case in Point: Marc Benioff, owner of TIME magazine.",0.0,Neutral,English
2024-11-26,"Contrary to dystopian nightmares about corporate overlords controlling the future, as with AI, in Robotics the free open source tech is keeping pace with Big Tech's capabilities.",0.0,Neutral,English
2024-11-16,Our Kids Shouldn't Be Silicon Valley's Guinea Pigs for AI | Opinion,0.0,Neutral,English
2024-11-15,What will replace handheld devices/handphones?,0.0,Neutral,English
2024-11-12,Extra futurology content from c/futurology - Weekly Roundup to 12th November 2024 🔭📡❇️,0.0,Neutral,English
2024-10-30,"Will robots become assistants, part of us, etc, like computers did first and then specially cell phones?",0.0,Neutral,English
2024-10-19,Silicon Valley Takes AGI Seriously—Washington Should Too,0.0,Neutral,English
2024-10-13,Silicon Valley is debating if AI weapons should be allowed to decide to kill,0.0,Neutral,English
2024-10-09,How far out before we have Smart Glasses that are pretty fleshed out like our smart phones today?,0.0,Neutral,English
2024-09-23,Strengthening Ties: UAE and US Collaboration in Technology,0.89439457654953,Positive,English
2024-08-14,"What do you think feels normal now, but in 20 years we will look back on and think was totally strange?",0.0,Neutral,English
2024-08-10,"Will the grand promises of Gene Editing, AI, Robotics etc come true?",0.0,Neutral,English
2024-07-28,When do you think we will have phones that rarely need to be plugged in?,0.0,Neutral,English
2024-07-10,How will future anti-aging treatments be distributed? ,0.0,Neutral,English
2024-06-24,Apple wants to replace 50% of iPhone final assembly line workers with automation,0.0,Neutral,English
2024-06-23,The Case for AGI by 2027,0.0,Neutral,English
2024-06-15,Tim Cook Admits Apple May Never Be Able to Make Its AI Stop Lying,-0.7290965914726257,Negative,English
2024-06-08,Do you think choice of AI assistant will become like browser choice?,0.0,Neutral,English
2024-06-07,Do you believe that in the future there will be stricter laws/regulations regarding internet & texting scams?? I’m so sick of all of the scams. What can be done?,-0.6956806778907776,Negative,English
2024-05-27,Is it possible that we could socially/culturally “go backwards” in time? ,0.0,Neutral,English
2024-04-05,What won't change?,0.0,Neutral,English
2024-03-24,The false promise of significant life extension? - how i imagine things could very well play out.,0.0,Neutral,English
2024-03-22,Digital world ,0.0,Neutral,English
2024-03-21,People do not take data privacy seriously enough,0.0,Neutral,English
2024-03-17,Apple Is in Talks to Let Google’s Gemini Power iPhone Generative AI Features,0.0,Neutral,English
2024-03-04,"In 1000 years, will tourists take pictures of Apple HQ's ruins?",0.0,Neutral,English
2024-03-03,Envisioning a Future with Open Source Communities for Physical Goods Production,0.0,Neutral,English
2024-02-29,What is the future of Banking?,0.0,Neutral,English
2024-02-28,Using technology to take democracy to the next level,0.0,Neutral,English
2024-02-28,"Despite being futurology, this subreddit's community has serious negativity and elitism surrounding technology advances",0.0,Neutral,English
2024-02-27,What do you think the next major personal device will be?,0.0,Neutral,English
2024-02-24,“Every profession will have an AI copilot by 2028”,0.0,Neutral,English
2024-02-19,What is your favorite device in computing or one you are looking forward to?,0.0,Neutral,English
2024-02-16,The Future of Cameras,0.0,Neutral,English
2024-02-15,Meet Me in the Eternal City: Silicon Valley Utopias. Who’s ready to move in?,0.0,Neutral,English
2024-02-15,Sensor Scavenges Energy From Wire's Magnetic Field. Energy management algorithms help IoT devices go battery free.,0.0,Neutral,English
2024-02-03,"What changes can quantum information (quantum computing, quantum sensing, quantum communication) bring to the manufacturing industry? Is it worth investing now?",0.0,Neutral,English
2024-01-30,How close are we to big tech companies trying another 'Google Glass' or similar wearable glasses tech?,0.0,Neutral,English
2024-01-27,Social media has failed the number one requirement of technology. It’s slowing and reversing human productivity.,-0.8831523060798645,Negative,English
2024-01-24,How do you react to AI-generated erotic content? A scientific study on the potential future of porn,0.0,Neutral,English
2024-01-14,Star Trek Computers,0.0,Neutral,English
2024-01-11,Does AI-Powered Conversation Tech Actually Exist?,0.0,Neutral,English
2024-12-30,Beware of Webull,-0.7096743583679199,Negative,English
2024-12-30,Webull not giving any money,0.0,Neutral,English
2024-12-26,Started Jan last year,0.0,Neutral,English
2024-12-25,To everyone skyptical of what I said,0.0,Neutral,English
2024-12-25,Difference between iPad and Android ,0.0,Neutral,English
2024-12-25,Gaps in options charts,0.0,Neutral,English
2024-12-23,Lost number- unrecoverable?,0.0,Neutral,English
2024-12-20,"Is it possible to read the charts YTD, last 3 months last year etc?  I hate the new graphs!!",-0.6518372297286987,Negative,English
2024-12-11,Why don't Money Market Instruments show up in Total Account Value on Desktop?,0.0,Neutral,English
2024-12-05,Desktop Download Issues on Macbook,0.0,Neutral,English
2024-12-04,"somewhat particular situation about account opening/usage - traveling alot/""digital nomad""/remote working etc.",0.0,Neutral,English
2024-12-04,Finally Here at 27 years old. Thank God 🚀,0.0,Neutral,English
2024-11-29,Help I'm new and don't know what I'm doing wrong,0.0,Neutral,English
2024-11-26,Lost access to my account.. please help,0.0,Neutral,English
2024-11-25,Indicator's label blocking the chart?!,0.0,Neutral,English
2024-11-21,iOS Widget,0.0,Neutral,English
2024-11-20,"Webull: Glitchy Desktop, Long Waits, and Unreliable Support",-0.5533547401428223,Negative,English
2024-11-18,Recently opened my Roth IRA and had a question,0.0,Neutral,English
2024-11-17,What is this called,0.0,Neutral,English
2024-11-14,restricted account,0.0,Neutral,English
2024-11-14,Desktop Webull Showing Different Account Balance than Webull Mobile App,0.0,Neutral,English
2024-11-10,Verification Code Not Working,0.0,Neutral,English
2024-11-07,Help setting up a filter,0.0,Neutral,English
2024-11-04,27m ,0.0,Neutral,English
2024-10-31,Trading Webull Futures through TradingView - Needed Improvements,0.0,Neutral,English
2024-10-31,Webull cancelled my GTC order right before market open and it would have executed ,-0.9036149978637695,Negative,English
2024-10-30,24 hours trading?,0.0,Neutral,English
2024-10-28,"Option Order Entry, broke on desktop app?",0.0,Neutral,English
2024-10-26,Someone please help🙏🙏,0.0,Neutral,English
2024-10-23,Why is paper trading on the desktop app so awful?,0.0,Neutral,English
2024-10-03,AAPL 10/3 5min chart,0.0,Neutral,English
2024-10-02,I don't see any deposit button - australia,0.0,Neutral,English
2024-10-01,How do you exercise ITM options early??,0.0,Neutral,English
2024-09-26,THIS IS ANNOIYNG ME,0.0,Neutral,English
2024-09-26,Why can't I see Level 1 best bid/ask on desktop?,0.0,Neutral,English
2024-09-24,What is this,0.0,Neutral,English
2024-09-12,What does this mean?,0.0,Neutral,English
2024-09-11,I got lucky for once I guess ,0.0,Neutral,English
2024-09-11,$500 AAPL Missing,0.0,Neutral,English
2024-09-09,How to change account type,0.0,Neutral,English
2024-09-05,Are Level 1 Quotes available on the Desktop app?,0.0,Neutral,English
2024-09-05,"Thursday Sep 5, android app extremely glitchy right now",-0.8576487302780151,Negative,English
2024-08-26,Missing from 8.2.1 MacOS,0.0,Neutral,English
2024-08-25,No matching account,-0.6215799450874329,Negative,English
2024-08-19,Abnormal account gains,-0.6394398808479309,Negative,English
2024-08-15,Rolling spreads and l3 strategies ,0.0,Neutral,English
2024-08-09,My iPad app is stuck in some weird mode and won’t go “full screen”,0.0,Neutral,English
