Date,Title,Score,Sentiment,Language
2024-12-27,Why the AI Hype is Another Tech Bubble,0.0,Neutral,English
2024-12-26,HIMS is a ticking time bomb,0.0,Neutral,English
2024-12-26,With 2024 coming to an end. What is your 2024YTD portfolio return? did you beat your benchmark?,0.0,Neutral,English
2024-12-26,I GOT OUT… on my way to Wendy..,0.0,Neutral,English
2024-12-24,4 year returns for the graduating tech employee class of 2021,0.0,Neutral,English
2024-12-24,I never buy enough ,0.0,Neutral,English
2024-12-24,I forgot to sell….. also forgot market closed today at 10 AM.. ,0.0,Neutral,English
2024-12-24,COIN Scalping,-0.5146113634109497,Negative,English
2024-12-23,I fixed my $4.15MM account deficit. Be aware of the risk of option early assignment.,-0.680070161819458,Negative,English
2024-12-20,$7.9k profit,0.0,Neutral,English
2024-12-19,NVDA AAPL gains realized (2 fotos),0.935636043548584,Positive,English
2024-12-18,Are you shitting me rn ,0.0,Neutral,English
2024-12-18,GUH,0.0,Neutral,German
2024-12-18,"“Hey Wife, look what I did today at work!” -JPOW",0.0,Neutral,English
2024-12-18,UNH is fighting for it’s life in the trenches,0.0,Neutral,English
2024-12-18,"Self-driving business grows 6x, Uber is clearly misplaced by the market and is on the verge of 50% upside",-0.9735881686210632,Negative,English
2024-12-17,"Marketing de-risking, Key Data and Opex Pressure?",-0.8027293682098389,Negative,English
2024-12-17,Not looking good,0.0,Neutral,Afrikaans
2024-12-17,MARA LEAPS YOLO,0.0,Neutral,Welsh
2024-12-15,TLT: The Bond Bet That Might Just Make You Rich When Everyone Else Is Crying,0.0,Neutral,English
2024-12-14,My wife just started options. She’s up 3k so far. Any advice?,0.0,Neutral,English
2024-12-13,"4yrs later, we profit. We are so back boyz 😈 😂 ",0.0,Neutral,English
2024-12-13,$YY - The Chinese Social Media App That’s Already Banned,-0.8177876472473145,Negative,English
2024-12-13,"TSMC 2024 results solid, 2nm tech progressing well, AI business outlook closed",0.9483386278152466,Positive,English
2024-12-11,"Quantum Computing was already picking up. After Alphabet annoucement, it is picking up more steam with Rigetti Computing up 14% today",0.9085684418678284,Positive,English
2024-12-11,Bought $16.2k worth of calls- Globalstar,0.0,Neutral,English
2024-12-10,Apple Watch Satellite capable ,0.0,Neutral,English
2024-12-10,MicroStrategy $MSTR will be added to the Nasdaq 100 on Friday,0.0,Neutral,English
2024-12-10,$NKE is a sleeping giant,-0.951131284236908,Negative,English
2024-12-09,TikTok trade part 2: Oracle Puts ⭐️3 ,0.0,Neutral,English
2024-12-09,I do think BB is a good investment now! Please don't remove this post!,0.8460415005683899,Positive,English
2024-12-08,$GOOG the BFTG,0.0,Neutral,English
2024-12-08,China's domination playbook. How China dominates industry after industry.,0.0,Neutral,English
2024-12-07,"DD Part 2: $RBRK, Rubrik ",0.0,Neutral,English
2024-12-07,MSTR Achilles Heel ,0.0,Neutral,English
2024-12-05,"$RBRK , Rubrik ",0.0,Neutral,English
2024-12-04,Roku’s real value is in the data.,0.0,Neutral,English
2024-12-03,"From 1k to 1M. If it can be done once, it can be done twice.",0.0,Neutral,English
2024-12-03,"Employee sues $AAPL, says Tim spying on them via personal devices ",-0.7865362167358398,Negative,English
2024-12-03,"Apple's stock price hits a new high, recapturing the number one spot in market cap. Is a new 'super product cycle' on the horizon?",0.9215293526649475,Positive,English
2024-11-30,"All In on SMCI: $6,000,000 Bet Across Interactive Brokers and My Swiss Bank – Am I Crazy or a Genius?",0.0,Neutral,English
2024-11-29,MRNA bounce incoming ,0.0,Neutral,English
2024-11-29,"Tech stocks rally: Nvidia, Alphabet, Microsoft in today's spotlight",0.0,Neutral,English
2024-11-29,Thank you Donald Trump for $TSLA gains and thank you Donald Trump Jr for $UMAC gains,0.0,Neutral,English
2024-11-28,"Enron is back, where do I invest?",0.0,Neutral,English
2024-11-28,Apple looking for a run to the upside?,0.0,Neutral,English
2024-11-27,Why $SPY is the Real Thanksgiving Turkey 🦃,0.0,Neutral,English
2024-11-26,When people start taking profit to buy gifts,0.0,Neutral,English
2024-11-26,AAPL 50k YOLO,-0.4031618535518646,Negative,English
2024-11-25,Stock Market: An Overspeculation Environment,0.0,Neutral,English
2024-11-22,Indonesia wants Apple to sweeten its $100 million proposal as tech giant lobbies for iPhone 16 sales,0.0,Neutral,English
2024-11-21,Here you go—you inbred sum b%tches!,0.0,Neutral,English
2024-11-21,Bye folks. This community ruined me and my life ,-0.8108490705490112,Negative,English
2024-11-21,2 month rollercoaster: 2k>55k > -25k > 125k ,-0.5544338822364807,Negative,English
2024-11-21,Why Nvidia may not follow the same fate as Cisco ,0.0,Neutral,English
2024-11-20,$RIVN: Riding to Valhalla,0.0,Neutral,English
2024-11-18,I think my friend sold me my calls on $SMCI,0.0,Neutral,English
2024-11-18,Trump taps big tech critic Carr to lead US communications agency,0.0,Neutral,English
2024-11-17,O yes! Netflix will be red tomorrow,0.0,Neutral,English
2024-11-12,The top is in,0.0,Neutral,English
2024-11-08,SPY calls for the win,-0.5640531182289124,Negative,English
2024-11-08,A Look at History: A Review of the 7 Bull Markets in U.S. Stocks Over the Past 50 Years,0.0,Neutral,English
2024-11-07,Globalstar Smashes Earnings with a 19.5% Revenue Beat! $GSAT 🚀,0.9561193585395813,Positive,English
2024-11-04,My market memoirs during the COVID 19 pandemic and the resultant market turmoil,0.0,Neutral,English
2024-11-01,SMCI Bull Thesis,-0.9080055356025696,Negative,English
2024-11-01,Apple Shoots for the Stars: Expanded Globalstar Deal Signals Big Moves in Satellite Tech,0.9397739171981812,Positive,English
2024-10-31,Trimming Appl before Berkshire results tomorrow ,-0.9704836010932922,Negative,English
2024-10-31,"Come on folks, this was such an obvious outcome",0.0,Neutral,English
2024-10-31,[MSOS/TLRY/CGC] DEA's ALJ hearing on cannabis rescheduling is delayed until January,-0.7439376711845398,Negative,English
2024-10-31,"Today is the 5th Anniversary of the ""Guh!"" Heard Round the World",0.0,Neutral,English
2024-10-31,"AMZN aand APPL earnings today, what do we think?",-0.9596748352050781,Negative,English
2024-10-30,"Trading Platform for Regards ($HOOD) Reports Q3 Earnings today, After-Hours",0.0,Neutral,English
2024-10-29,What do we think?,0.0,Neutral,English
2024-10-28,Apple Ships $6 Billion of iPhones From India in Big China Shift,0.9210340976715088,Positive,English
2024-10-28,META Earnings and the Raybans...,0.0,Neutral,English
2024-10-28,PYPL & CROX earnings play (feat. 2 bonus lotto gambles),0.0,Neutral,English
2024-10-26,My 100x companies 🤜📈,0.0,Neutral,English
2024-10-25,How are most of our portfolios looking? ,0.0,Neutral,English
2024-10-25,Weekly Earnings thread 10/28 - 11/1,0.0,Neutral,English
2024-10-25,UWMC DD and Unusual Options Activity,0.0,Neutral,English
2024-10-24,Expectations for Berkshire pre-election,-0.7585650682449341,Negative,English
2024-10-24,Fuck my life… part 2,0.0,Neutral,English
2024-10-24,Happy with the gain even though it’s still running ,0.5708256959915161,Positive,English
2024-10-24,"Apple Stock Up Catalysts: Tim Cook Visit China, New Gaming Hub",0.930814802646637,Positive,English
2024-10-23,I think I should take the rest of the year off,0.0,Neutral,English
2024-10-23,TSLA Earnings beat ,0.0,Neutral,English
2024-10-22,My highest percentage P&L trade yet ,0.68808913230896,Positive,English
2024-10-22,AI is not a bubble.,0.0,Neutral,English
2024-10-20,"Keep away from JD, it may be the next Silicon Valley Bank",0.0,Neutral,English
2024-10-18,Apple Sell To Open Call 12/20/24 $255 - I got premium of $223,0.530044674873352,Positive,English
2024-10-18,Apple on the Chinese market ,0.9533200263977051,Positive,English
2024-10-17,"YoY: 56%, YTD: 35.6% - Living at home changed my life",0.0,Neutral,English
2024-10-16,baby’s first year trading options with prideful 250%+ YTD - AMA or roast me.,0.0,Neutral,English
2024-10-15, ASTS vs SpaceX drama regarding FCC regulations ,0.0,Neutral,English
2024-10-14,IonQ will experience a massive rally and has multiple catalysts on the horizon.,0.5128355622291565,Positive,English
2024-10-10,"When will ""investor"" delusion end?",0.0,Neutral,English
2024-10-09,Apple sells privacy to consumers. But it’s quietly helping police use iPhones for surveillance.,0.0,Neutral,English
2024-10-09,TSMC Earnings Ahead: Could this cause NVDA to reach new highs?,0.9276543855667114,Positive,English
2024-10-09,"Worst decisions of my life, so far",-0.3893110454082489,Negative,English
2024-10-08,Maybe now I can afford a phone charger ,0.0,Neutral,English
2024-10-07,Does Wendy’s have sign up bonuses?,0.0,Neutral,English
2024-10-07,Is INTC undervalued ?,-0.8889824151992798,Negative,English
2024-10-06,"Uninstalled app for a year, came back to 10k gains",0.0,Neutral,English
2024-10-06,Googles grip on search slips to TikTok and AI Startups ,0.0,Neutral,English
2024-10-05,Is Palantir the Next Big Tech Stock or Overvalued Hype?,0.9486672282218933,Positive,English
2024-10-04,Domino’s (DPZ) Calls Are About to Print – Don’t Miss Out on the Next Moonshot -Earnings,0.0,Neutral,English
2024-10-03,"Trading UVIX / AAPL EARNINGS, So... How will I mess this UP🆙↕️",0.0,Neutral,English
2024-10-01,"Have I actually figured something out that works, or did I just get lucky during a bullish year?",0.0,Neutral,English
2024-09-27,What the impending stagflation in Russia (might) mean for you: An in-depth look,0.0,Neutral,English
2024-09-26,Those buying Costco calls today are actually betting against Costco,0.9390117526054382,Positive,English
2024-09-25,$3k in one day,-0.7593136429786682,Negative,English
2024-09-24,What exactly should we do after a big YOLO Gain?,0.0,Neutral,English
2024-09-24,"RIVN vs. TSLA - Rivian Target - $45+, Tesla ? ",0.0,Neutral,English
2024-09-23,Most money I've ever made :),0.0,Neutral,English
2024-09-22,Talking about $INTC Takeover Rumors and Apollo Deal,0.0,Neutral,English
2024-09-20,PayPal Back From The Dead?,-0.9602578282356262,Negative,English
2024-09-20,Thank the fed rate cut,0.0,Neutral,English
2024-09-16,"Apple’s $100 billion drop sends stock to 5-week low as iPhone demand questions linger
",-0.9399389028549194,Negative,English
2024-09-16,Apple shares slid Monday after reports that demand for the new iPhone 16 is lower than expected — and down 12% year over year,-0.9757115840911865,Negative,English
2024-09-15,"iPhone 16 Pro Demand Has Been Lower Than Expected, Analyst Says",-0.9716460704803467,Negative,English
2024-09-13,"If you ain’t seeing red, you’re wrong!",0.0,Neutral,English
2024-09-12,Apple Slammed with a €13 Billion Tax Bill as Tim Cook's Worst Nightmare Comes True,-0.7470956444740295,Negative,English
2024-09-12,A closer look into Klaviyo (KVYO),0.0,Neutral,English
2024-09-12,Nvidia’s Margin Forecast Shake-Up: How September 9-10 Set Off Alarms in the Semiconductor Sector Amid Tesla’s China Surge and Apple’s Roller,-0.797539472579956,Negative,English
2024-09-11,Thank you my sweet NVIDIA ,0.0,Neutral,English
2024-09-10,"Introducing the iPhone 16, the biggest innovation in losing your money since Robinhood",0.0,Neutral,English
2024-09-10,My reaction at every iPhone release nowadays,0.0,Neutral,English
2024-09-10,Impact of iPhone 16 launch on Apple stock price - Investing Abroad News | The Financial Express,0.0,Neutral,English
2024-09-10,$Apple$ $Google$,-0.8911071419715881,Negative,English
2024-09-09,Apple’s $3.3 Trillion Gamble on AI iPhone 16 Backfires as Stock Sinks and Investors Yawn,-0.9542842507362366,Negative,English
2024-09-09,The best play of the year after NVDA : OXY petroleum ,-0.9588966369628906,Negative,English
2024-09-09,Avengers: INTC War,0.0,Neutral,English
2024-09-09,Apple lost its innovative magic？,-0.5269331932067871,Negative,English
2024-09-09,Apple Glowtime Event,-0.5414166450500488,Negative,English
2024-09-09,Intel is a pretty safe bet and are undervalued ,-0.9679090976715088,Negative,English
2024-09-08,AI is dead,0.0,Neutral,English
2024-09-08,Jensen Huang Q2 2025 conference call comment : This is what tells me Ai is still in the very first inning of a nine inning game ,0.0,Neutral,English
2024-09-07,Well… it is what it is,0.0,Neutral,English
2024-09-06,SPY put is EXPLOOOODDDIIINNNGG 💥💥💥🚀🚀🚀🚀,0.0,Neutral,English
2024-09-05,First DD: Bullish on Delta (DAL) through both technical and fundamental analysis in the medium term,-0.9470342993736267,Negative,English
2024-09-04,Changes ,-0.5340664982795715,Negative,English
2024-09-04,$PBF: Insiders can show you when and how to double your money,0.0,Neutral,English
2024-09-04,How regarded am I?,0.0,Neutral,English
2024-09-03,AAPL vs. NVDA Comps,0.0,Neutral,English
2024-09-03,Don't Bet on Apple's Stock to Surge After iPhone Announcement,-0.6368111968040466,Negative,English
2024-08-31,Guess I have to keep working ,0.0,Neutral,English
2024-08-30,UPDATE: I lost my life savings shorting copper & a naked call was assigned to me + margin called,0.0,Neutral,English
2024-08-30,Perfection ,0.0,Neutral,English
2024-08-30,An Apple a Day Keeps the Doctor Away. More APPL long term goodness,0.0,Neutral,English
2024-08-29,"NVDA will hit 5T market cap in 2026, and 10T market cap before 2032.",0.0,Neutral,English
2024-08-29,AAPL; please stay up this time to keep over 7 figures,0.0,Neutral,English
2024-08-29,ASTS DD and YOLO part.2,-0.4538642168045044,Negative,English
2024-08-28,Nvidia reports 122% revenue growth on surging demand for data center chips,-0.9705737829208374,Negative,English
2024-08-28,NVDA Gross Margin Forecast Disappoints ,-0.9136620163917542,Negative,English
2024-08-28,Received it from my wife's boyfriend ,0.0,Neutral,English
2024-08-27,"The next tech giant. Why $HOOD, $PLTR and $DKNG are the investment opportunities of a lifetime. (Part 1)",0.0,Neutral,English
2024-12-31,"r/GME Megathread for January 01, 2025",-0.8433962464332581,Negative,English
2024-12-30,"r/GME Megathread for December 31, 2024",-0.842647910118103,Negative,English
2024-12-30,Regarding RCs latest Tweet,0.8715463280677795,Positive,English
2024-12-29,"r/GME Megathread for December 30, 2024",-0.8430047035217285,Negative,English
2024-12-28,"r/GME Megathread for December 29, 2024",-0.8430541753768921,Negative,English
2024-12-27,"r/GME Megathread for December 28, 2024",-0.8431125283241272,Negative,English
2024-12-27,What is the sharpe ratio of GME??? ,0.0,Neutral,English
2024-12-26,"r/GME Megathread for December 27, 2024",-0.8433996438980103,Negative,English
2024-12-26,GME not updating on google. Dec. 24th is the last date updated. Strange. ,0.0,Neutral,English
2024-12-25,"r/GME Megathread for December 26, 2024",-0.8432055711746216,Negative,English
2024-12-24,"r/GME Megathread for December 25, 2024",-0.8416649103164673,Negative,English
2024-12-23,"r/GME Megathread for December 24, 2024",-0.8429673910140991,Negative,English
2024-12-22,"r/GME Megathread for December 23, 2024",-0.8428933620452881,Negative,English
2024-12-21,"r/GME Megathread for December 22, 2024",-0.8430944681167603,Negative,English
2024-12-20,"r/GME Megathread for December 21, 2024",-0.8423911929130554,Negative,English
2024-12-20,The SEC needs to dial for dollars,0.0,Neutral,English
2024-12-19,"r/GME Megathread for December 20, 2024",-0.8421246409416199,Negative,English
2024-12-19,Time person of year,0.0,Neutral,English
2024-12-18,"r/GME Megathread for December 19, 2024",-0.84227055311203,Negative,English
2024-12-18,Roaring Kitty’s 💥 has happened!,0.0,Neutral,English
2024-12-17,"r/GME Megathread for December 18, 2024",-0.8427595496177673,Negative,English
2024-12-17,Took a screenshot during the sneeze,0.0,Neutral,English
2024-12-16,"r/GME Megathread for December 17, 2024",-0.8430509567260742,Negative,English
2024-12-15,"r/GME Megathread for December 16, 2024",-0.8433651328086853,Negative,English
2024-12-14,These numbers seem big. Are they? Educate me 💡,0.0,Neutral,English
2024-12-14,"r/GME Megathread for December 15, 2024",-0.8430871963500977,Negative,English
2024-12-13,"r/GME Megathread for December 14, 2024",-0.8433786034584045,Negative,English
2024-12-12,"r/GME Megathread for December 13, 2024",-0.8427671790122986,Negative,English
2024-12-11,"r/GME Megathread for December 12, 2024",-0.8421871662139893,Negative,English
2024-12-10,"r/GME Megathread for December 11, 2024",-0.842388391494751,Negative,English
2024-12-10,Off we go!,0.0,Neutral,Welsh
2024-12-09,"r/GME Megathread for December 10, 2024",-0.8429319858551025,Negative,English
2024-12-08,"r/GME Megathread for December 09, 2024",-0.8428632020950317,Negative,English
2024-12-07,"r/GME Megathread for December 08, 2024",-0.8427876234054565,Negative,English
2024-12-06,"r/GME Megathread for December 07, 2024",-0.8416730165481567,Negative,English
2024-12-05,"r/GME Megathread for December 06, 2024",-0.8424792289733887,Negative,English
2024-12-04,"r/GME Megathread for December 05, 2024",-0.8405603170394897,Negative,English
2024-12-04,What usually happens to GME after Ethereum classic goes up?,0.0,Neutral,English
2024-12-03,"r/GME Megathread for December 04, 2024",-0.8421288728713989,Negative,English
2024-12-03,I genuinely hate these posts...,0.0,Neutral,English
2024-12-02,"r/GME Megathread for December 03, 2024",-0.8408939838409424,Negative,English
2024-12-02,Day #17 of buying 1 (2) share per day until moass,0.0,Neutral,English
2024-12-01,"r/GME Megathread for December 02, 2024",-0.8410940766334534,Negative,English
2024-11-30,"r/GME Megathread for December 01, 2024",-0.8418126106262207,Negative,English
2024-11-29,"r/GME Megathread for November 30, 2024",-0.8432185649871826,Negative,English
2024-11-28,"r/GME Megathread for November 29, 2024",-0.8433159589767456,Negative,English
2024-11-27,"r/GME Megathread for November 28, 2024",-0.8433772325515747,Negative,English
2024-11-27,"Change in institutional ownership last quarter, seems normal for a company with  an management incompetence facing imminent obsolescence. ",-0.7607115507125854,Negative,English
2024-11-26,"r/GME Megathread for November 27, 2024",-0.8436478972434998,Negative,English
2024-11-26,If the recent trendline continues this is chatgpts price prediction thru 2026. Personally I am diamond balling it till i see phone numbers. ,0.0,Neutral,English
2024-11-26,GameStop baby ,0.0,Neutral,English
2024-11-25,Apple Stocks showing actual price?,0.0,Neutral,English
2024-11-25,"r/GME Megathread for November 26, 2024",-0.8435155749320984,Negative,English
2024-11-25,Thank you GameStop for the incredible Black Friday deals!,0.7641743421554565,Positive,English
2024-11-24,"r/GME Megathread for November 25, 2024",-0.8418866991996765,Negative,English
2024-11-23,"r/GME Megathread for November 24, 2024",-0.8432029485702515,Negative,English
2024-11-22,"r/GME Megathread for November 23, 2024",-0.8431854248046875,Negative,English
2024-11-21,"r/GME Megathread for November 22, 2024",-0.8434235453605652,Negative,English
2024-11-20,"r/GME Megathread for November 21, 2024",-0.8427514433860779,Negative,English
2024-11-20,German news bullish again...,0.9488604664802551,Positive,English
2024-11-19,"r/GME Megathread for November 20, 2024",-0.8424614667892456,Negative,English
2024-11-18,"r/GME Megathread for November 19, 2024",-0.8426214456558228,Negative,English
2024-11-17,"r/GME Megathread for November 18, 2024",-0.8430717587471008,Negative,English
2024-11-16,"r/GME Megathread for November 17, 2024",-0.8434411883354187,Negative,English
2024-11-15,"r/GME Megathread for November 16, 2024",-0.8439045548439026,Negative,English
2024-11-15,GME vs FAANG,0.0,Neutral,Slovenian
2024-11-14,"r/GME Megathread for November 15, 2024",-0.8434286117553711,Negative,English
2024-11-13,"r/GME Megathread for November 14, 2024",-0.8438481688499451,Negative,English
2024-11-12,"r/GME Megathread for November 13, 2024",-0.8432322144508362,Negative,English
2024-11-12,"DFV's first comment on Reddit Interesting observations
",0.0,Neutral,English
2024-11-11,"r/GME Megathread for November 12, 2024",-0.8427623510360718,Negative,English
2024-11-10,"r/GME Megathread for November 11, 2024",-0.8427026867866516,Negative,English
2024-11-09,"r/GME Megathread for November 10, 2024",-0.8432407379150391,Negative,English
2024-11-08,"r/GME Megathread for November 09, 2024",-0.8434022068977356,Negative,English
2024-11-07,"r/GME Megathread for November 08, 2024",-0.8430564403533936,Negative,English
2024-11-06,"r/GME Megathread for November 07, 2024",-0.8420099020004272,Negative,English
2024-11-05,"r/GME Megathread for November 06, 2024",-0.8429689407348633,Negative,English
2024-11-04,"r/GME Megathread for November 05, 2024",-0.8410530090332031,Negative,English
2024-11-04,What are your honest opinions / feelings about what might happen to GME?,0.0,Neutral,English
2024-11-03,"r/GME Megathread for November 04, 2024",-0.8423876166343689,Negative,English
2024-11-02,"r/GME Megathread for November 03, 2024",-0.8413125276565552,Negative,English
2024-11-01,"r/GME Megathread for November 02, 2024",-0.8416659832000732,Negative,English
2024-11-01,Got mine too!!! Earlier than expected. ,0.6186661124229431,Positive,English
2024-10-31,"r/GME Megathread for November 01, 2024",-0.8423374891281128,Negative,English
2024-10-31,New Raptor 8 arrived!,0.0,Neutral,English
2024-10-30,"r/GME Megathread for October 31, 2024",-0.842930793762207,Negative,English
2024-10-29,"r/GME Megathread for October 30, 2024",-0.8427942991256714,Negative,English
2024-10-28,"r/GME Megathread for October 29, 2024",-0.8432203531265259,Negative,English
2024-10-27,"r/GME Megathread for October 28, 2024",-0.8431426882743835,Negative,English
2024-10-26,"r/GME Megathread for October 27, 2024",-0.8435353636741638,Negative,English
2024-10-25,"r/GME Megathread for October 26, 2024",-0.8434564471244812,Negative,English
2024-10-24,"r/GME Megathread for October 25, 2024",-0.8417947888374329,Negative,English
2024-10-24,"There are Portfolio Swaps between GameStop and an unknown other stock, or unknown stocks. Which one(s) can it be?",0.0,Neutral,English
2024-10-23,"r/GME Megathread for October 24, 2024",-0.8432568907737732,Negative,English
2024-10-22,"r/GME Megathread for October 23, 2024",-0.8430972099304199,Negative,English
2024-10-21,"r/GME Megathread for October 22, 2024",-0.8431641459465027,Negative,English
2024-10-20,"r/GME Megathread for October 21, 2024",-0.8426835536956787,Negative,English
2024-10-19,"r/GME Megathread for October 20, 2024",-0.8422061204910278,Negative,English
2024-10-18,"r/GME Megathread for October 19, 2024",-0.8425934910774231,Negative,English
2024-10-17,"r/GME Megathread for October 18, 2024",-0.8429331183433533,Negative,English
2024-10-16,"r/GME Megathread for October 17, 2024",-0.84324049949646,Negative,English
2024-10-15,"r/GME Megathread for October 16, 2024",-0.8434706926345825,Negative,English
2024-10-14,"r/GME Megathread for October 15, 2024",-0.8431966304779053,Negative,English
2024-10-13,"r/GME Megathread for October 14, 2024",-0.8434746265411377,Negative,English
2024-10-12,"r/GME Megathread for October 13, 2024",-0.8429951071739197,Negative,English
2024-10-11,"r/GME Megathread for October 12, 2024",-0.842429518699646,Negative,English
2024-10-11,"I’m pretty sure “Botox? 💉” is in reference to Larry Ellison, CEO of Oracle… you may want to own GME before we get equity in Teddy 🍻 ",0.0,Neutral,English
2024-10-10,"r/GME Megathread for October 11, 2024",-0.842722475528717,Negative,English
2024-10-09,"r/GME Megathread for October 10, 2024",-0.8428857326507568,Negative,English
2024-10-08,"r/GME Megathread for October 09, 2024",-0.8428913950920105,Negative,English
2024-10-08,Putting it all together; current events I'm watching as we wait for 🇺🇸🎶🎤,0.0,Neutral,English
2024-10-07,"r/GME Megathread for October 08, 2024",-0.8428676128387451,Negative,English
2024-10-06,"r/GME Megathread for October 07, 2024",-0.8417245149612427,Negative,English
2024-10-05,"r/GME Megathread for October 06, 2024",-0.8426373600959778,Negative,English
2024-10-04,"r/GME Megathread for October 05, 2024",-0.8408545255661011,Negative,English
2024-10-03,"r/GME Megathread for October 04, 2024",-0.8421056866645813,Negative,English
2024-10-03,"Since your brains are too smooth, here are my 5.24 Expirations",0.0,Neutral,English
2024-10-02,"r/GME Megathread for October 03, 2024",-0.8407759070396423,Negative,English
2024-10-01,"r/GME Megathread for October 02, 2024",-0.8411546945571899,Negative,English
2024-09-30,"r/GME Megathread for October 01, 2024",-0.8419012427330017,Negative,English
2024-09-29,"r/GME Megathread for September 30, 2024",-0.8422289490699768,Negative,English
2024-09-29,"Canadian Apes, did you know your pension funds (combined) is holding over twice the outstanding shares in XRT (Retail ETF that holds GME and 🐶 Stock)? ",0.0,Neutral,English
2024-09-28,"r/GME Megathread for September 29, 2024",-0.8425959348678589,Negative,English
2024-09-27,"r/GME Megathread for September 28, 2024",-0.8424559831619263,Negative,English
2024-09-26,"r/GME Megathread for September 27, 2024",-0.842808187007904,Negative,English
2024-09-25,"r/GME Megathread for September 26, 2024",-0.8426801562309265,Negative,English
2024-09-24,"r/GME Megathread for September 25, 2024",-0.8409798741340637,Negative,English
2024-09-24,Kitty charts - new highlight?,0.0,Neutral,English
2024-09-23,"r/GME Megathread for September 24, 2024",-0.8424453139305115,Negative,English
2024-09-23,Seems to be a lot of AH activity… 🤔,0.0,Neutral,English
2024-09-22,"r/GME Megathread for September 23, 2024",-0.8423609733581543,Negative,English
2024-09-21,"r/GME Megathread for September 22, 2024",-0.8424962759017944,Negative,English
2024-09-21,Thinking ahead: combatting scalpers whenever PS6 and other hot consoles are released.,0.0,Neutral,English
2024-09-20,"r/GME Megathread for September 21, 2024",-0.8418209552764893,Negative,English
