Date,Title,Score,Sentiment,Language
2021-12-22,RH account hacked. Money stolen and account was deactivated.,-0.7097359895706177,Negative,English
2021-12-10,Penny Stock Unusual Option Activity 12/10,-0.8934166431427002,Negative,English
2021-11-10,Penny Stock Unusual Option Activity 11/10,-0.9695190191268921,Negative,English
2021-11-03,Penny Stock Unusual Option Activity 11/3,0.9437295198440552,Positive,English
2021-11-01,Penny Stock Unusual Option Activity 11/1,0.937757670879364,Positive,English
2021-10-28,Penny Stock Unusual Option Activity 10/28,0.5526670217514038,Positive,English
2021-10-25,Penny Stock Unusual Option Activity 10/25,0.9423011541366577,Positive,English
2021-10-19,Penny Stock Unusual Option Activity 10/19,0.9405236840248108,Positive,English
2021-10-18,Penny Stock Unusual Option Activity 10/18,0.9302219748497009,Positive,English
2021-10-14,Penny Stock Unusual Option Activity 10/14,-0.9460287094116211,Negative,English
2021-10-13,Penny Stock Unusual Option Activity 10/13,0.515332043170929,Positive,English
2021-10-05,Rant and Penny Stock Unusual Option Activity 10/5,0.7243529558181763,Positive,English
2021-10-04,Penny Stock Unusual Option Activity 10/4,-0.9726886749267578,Negative,English
2021-09-18,Biotricity does it again,0.6189677715301514,Positive,English
2021-09-16,EOD Penny Stock Unusual Option Activity 9/16,0.8523457050323486,Positive,English
2021-09-16,Mid-Day Penny Stock Unusual Option Activity 9/16,-0.49949225783348083,Negative,English
2021-09-14,EOD Penny Stock Unusual Option Activity 9/14,-0.967596173286438,Negative,English
2021-09-13,EOD Penny Stock Unusual Option Activity 9/13,-0.592252254486084,Negative,English
2021-09-13,Mid-Day Penny Stock Unusual Option Activity 9/13,0.0,Neutral,English
2021-09-10,EOD Penny Stock Unusual Option Activity 9/10,-0.9663233160972595,Negative,English
2021-09-02,EOD Penny Stock Unusual Option Activity 9/2,0.0,Neutral,English
2021-09-02,GSAT up in premarket ?!,0.0,Neutral,English
2021-09-01,EOD Penny Stock Unusual Option Activity 9/1,0.0,Neutral,English
2021-08-31,EOD Penny Stock Unusual Option Activity 8/31,0.0,Neutral,English
2021-08-31,Mid-Day Penny Stock Unusual Option Activity 8/31,-0.47441360354423523,Negative,English
2021-08-30,EOD Penny Stock Unusual Option Activity 8/30,0.0,Neutral,English
2021-08-30,Mid-Day Penny Stock Unusual Option Activity 8/30,0.0,Neutral,English
2021-08-19,Penny Stock Unusual Option Activity 8/19,0.0,Neutral,English
2021-08-18,Penny Stock Unusual Option Activity 8/18,0.0,Neutral,English
2021-08-13,*no position DD* SQFT - a young microcap REIT,0.0,Neutral,English
2021-08-09,"Wilhelmina International, Inc. (WHLM) - 5.44 (-1.98%)",0.0,Neutral,English
2021-08-07,Bulls Take Kaixin Shares High Post New EV Business Unit Establishment Announcement,-0.942135214805603,Negative,English
2021-07-24,Penny Stock Unusual Option Activity 7/23,0.0,Neutral,English
2021-07-22,Inpixon ($INPX) Back to the Office and Data Analytics,0.0,Neutral,English
2021-07-16,Penny Stock Unusual Options Volume 7/16,0.0,Neutral,English
2021-06-29,$XELA Potential for this week,0.9083356857299805,Positive,English
2021-06-02,Good news. LKCO's eMapGo is officially partnering with Microsoft to work on self-driving cars,0.0,Neutral,English
2021-05-23,"Morgan Stanley reports 6,149.70% increase in ownership of SNDL / Sundial Growers Inc - 13F, 13D, 13G Filings - Fintel.io",0.7448501586914062,Positive,English
2021-05-22,*no position DD* AHT - put it on the Ritz,0.0,Neutral,English
2021-05-21,"*no position DD* NVOS - Canadian healthcare, eh?",0.0,Neutral,English
2021-05-18,One app to rule them all?,0.0,Neutral,English
2021-05-14,Sat on my phone,0.0,Neutral,English
2021-05-12,"Why is $GTE Down With Tech Stocks, This Market Makes No Sense. Fragmented is the word",0.0,Neutral,English
2021-04-28,*no position DD* LYG - knackered bank on the rebound,0.0,Neutral,English
2021-04-23,SENS comeback story?,0.0,Neutral,English
2021-04-15,*no position DD* PHUN - are we having phun yet,0.0,Neutral,English
2021-04-02,Hey Geniuses --- Here's a DD list ($GNUS),0.0,Neutral,English
2021-04-02,*no position DD* GSAT - witty title here I dunno,0.5582813024520874,Positive,English
2021-03-29,$EAST Earnings and Board Update - Huge Bull Balls,0.0,Neutral,English
2021-03-26,*no position DD* TXMD - Women's Health Innovator,0.0,Neutral,English
2021-03-25,FNGD - Your friend when tech goes down ($3.95/share),0.0,Neutral,English
2021-03-24,Micro-cap just starting to take-off! Fintech blockchain and NFT play. AEHL-Antelope Holdings. Look past finviz description. Read below...,0.0,Neutral,English
2021-03-23,*no position DD* RMTI - a hard time finding bad news,0.0,Neutral,English
2021-03-23,Some Interesting Stuff In Tech Today + NFT Stocks,0.0,Neutral,English
2021-03-22,*no position DD* IFMK - Homemade Mongolian Beef,0.0,Neutral,English
2021-03-20,"My suggestion based on the upcoming week, NFT and BUY DSS",0.0,Neutral,English
2021-03-19,*no position DD* SHIP - maritime madness,0.0,Neutral,English
2021-03-15,"*no position DD* OSG - a bigger, worse CTRM",0.0,Neutral,English
2021-03-15,"*no position DD* ITP - Alexa, play the Office theme",0.0,Neutral,English
2021-03-14,$Pulm DD// mid/long term hold,0.0,Neutral,English
2021-03-12,*no position DD* SENS - cyberpunk sugar77,0.0,Neutral,English
2021-03-11,*no position DD* DARE - a different kind of stimulus,0.0,Neutral,English
2021-03-11,"*no position DD* AESE - Esports, Poker, and mega deal drama",0.0,Neutral,English
2021-03-11,"CSCW - Social Media, Film Magnate, AI. A lot for a little (sub $1)",0.0,Neutral,English
2021-03-10,SONM Fourth Fourth Quarter 2020 and Recent Highlights,0.9354057312011719,Positive,English
2021-03-10,NDRA - Med-tech with a big boy behind it,0.0,Neutral,English
2021-03-09,"IsoRay, Inc - Cancer Zapper. Med-Tech Dancer.",0.0,Neutral,English
2021-03-09,DFFN presentation material,0.0,Neutral,Italian
2021-03-09,Missing history on RH,0.0,Neutral,English
2021-03-04,"$HSTO Shorted Heavily, a closer look👀",0.0,Neutral,English
2021-03-02,SLGG possible connection to GME,0.0,Neutral,English
2021-03-02,SENS awarded patent today.,-0.5560019612312317,Negative,English
2021-02-27,Pyxis Tankers......,0.0,Neutral,English
2021-02-25,Anyone heard of AMPE? (Not a DD),0.6334336996078491,Positive,English
2021-02-24,Watchlist 2-25-21 👀,0.0,Neutral,English
2021-02-24,DD on SNGX,0.0,Neutral,English
2021-02-24,"GSAT DD (It's the spectrum, stupid)",0.0,Neutral,English
2021-02-23,Algo that tracks the most hyped stocks on Reddit. Here are the results for this week - 2/23/2021,0.0,Neutral,English
2021-02-23,2/23 Trending Penny Stocks on Reddit (with DDs),0.0,Neutral,English
2021-02-23,Strategies on taking advantage of the correction,0.0,Neutral,English
2021-02-22,DD#2 Inpixon ($INPX) - IoT Sensors for smarter indoor solution + Covid play,0.0,Neutral,English
2021-02-18,"A noob's DD. Looking for feedback. Some of it is funny, I swear.",0.0,Neutral,English
2021-02-18,"$XXII DD, Plant Biotech with an Upcoming Catalyst",0.0,Neutral,English
2021-02-18,"$SOS IS MOST LIKELY A SCAM, HERE IS WHY.",0.0,Neutral,English
2021-02-15,1k to 10k: Week 1 - 5% gain stocks?,0.0,Neutral,English
2021-02-15,Watchlist 2-16-21 👀,-0.939638614654541,Negative,English
2021-02-14,Stocks I am watching this week (and why) - feb 16 2021,0.0,Neutral,English
2021-02-12,Rolls-Royce is a tech stock move,0.0,Neutral,English
2021-02-12,$ENTX - Entera Bio Ltd. - A Comprehensive DD guide to this Biopharma's innovative treatment potential,0.845044732093811,Positive,English
2021-02-11,PULM - Offering Swing Play - 22% down,-0.8289909958839417,Negative,English
2021-02-10,Watchlist 2-11-21 👀,0.0,Neutral,English
2021-02-09,Watchlist 2-10-21 👀,0.0,Neutral,English
2021-02-09,"IsoRay $ISR has their quarterly earnings report today, get ready to buy on the dip tomorrow",0.0,Neutral,English
2021-02-07,"$LKCO, Luokung Technology, is a sleeping giant in the cloud geospatial world",0.0,Neutral,English
2021-02-05,"$SPCB Explosive Potential, Good Catalyst.",0.0,Neutral,English
2021-02-05,"NOVN, really good DD from r/pennystocks",0.0,Neutral,English
2021-02-04,"Just curious, how $RIGL does not receive any recognition? Only Pharma with DoD endorsement/Funding at phase 3. Still under $5 with 100% buy",0.0,Neutral,English
2021-02-02,AZRX patent granted for their COVID19 drug,0.0,Neutral,English
2021-01-31,"$XSPA , OUR NEXT CHANCE",0.0,Neutral,English
2021-01-29,Anyone see that spike and crash on $NOK? Anyone know what that was about? This is crazy.,-0.6716797351837158,Negative,English
2021-01-28,Watchlist 1-29-21 👀,-0.7654891014099121,Negative,English
2021-01-28,"$TRCH DD + Recent News, Activity, and Sector Developments",0.0,Neutral,English
2021-01-28,"REI, RING ENERGY INSIDER purchases 6,600,180 additional shares.",0.0,Neutral,English
2021-01-28,Catalyst for SENS This Weekend,0.0,Neutral,English
2021-01-26,Watchlist 1-27-21 👀,0.9381186366081238,Positive,English
2021-01-25,“Watchlist 1-26-21 👀Futures are RED as of 10:45 ET,-0.9601413607597351,Negative,English
2021-01-25,"Ring Energy, Inc., Announces Relocation of Its Headquarters From Midland, Texas to The Woodlands, Texas. The move will save 15% annually. $REI",0.0,Neutral,English
2021-01-24,“Watchlist 1-25-21 👀,0.0,Neutral,English
2021-01-21,Watchlist 1-22-21 👀,0.0,Neutral,English
2021-01-21,DD on $NOK by /u/jbow234,0.0,Neutral,English
2021-01-21,🚨 In-Depth DD on $ATOS and its January 26th COVID updates at the Public Medicine World Conference (my view on why the price is moving),0.6533340811729431,Positive,English
2021-01-20,Watchlist 1-21-21 👀,0.5968878865242004,Positive,English
2021-01-20,Repost check it out.,0.0,Neutral,English
2021-01-19,Watchlist 1-20-21 👀,0.0,Neutral,English
2021-01-18,Watchlist 1-19-21 👀,0.7012456059455872,Positive,English
2021-01-17,Biggest Stock Market Lessons of 2020,0.0,Neutral,English
2021-01-14,Watchlist 1-15-21 👀,0.0,Neutral,English
2021-01-14,⚠️ In-Depth DD on $SENS & George Soros ties to this pennystock,0.0,Neutral,English
2021-01-14,What do you guys think of Canaan?,0.0,Neutral,English
2021-01-13,Watchlist 1-14-21 👀,0.0,Neutral,English
2021-01-12,Watchlist 1-13-21 👀,-0.9383083581924438,Negative,English
2021-01-12,Who’s still in NAKD?,0.0,Neutral,English
2021-01-11,Watchlist 1-12-21 👀,-0.8888328671455383,Negative,English
2021-01-11,PTE going up again 🚀,0.0,Neutral,English
2021-01-10,Watchlist 1-11-21 👀,0.0,Neutral,English
2021-01-08,Borqs Technologies (BRQS) on the rise!,0.648575484752655,Positive,English
2021-01-07,Watchlist 1-8-21 👀,0.0,Neutral,English
2021-01-06,Watchlist 1-7-21 👀,-0.7737142443656921,Negative,English
2021-01-05,Watchlist 1-6-21 👀,0.0,Neutral,English
2021-01-01,Logging into Robinhood with my computer,0.0,Neutral,English
2021-11-27,"I'm poor. And new here! These are my first investments made, ever!",0.0,Neutral,English
2021-10-16,How predictable are seasonal rises/falls in the stock market?,0.0,Neutral,English
2021-09-17,"In Robinhood, what happens when the short leg, of a Put Credit Spread, is in the money and is assigned?",0.0,Neutral,English
2021-08-27,How does one determine what price traders want to buy options at?,0.0,Neutral,English
2021-08-19,Just got RobinHood. Question about 2-Factor Verification with push notifications.,0.0,Neutral,English
2021-05-15,FAANG Stock Performance 2021,0.0,Neutral,English
2021-04-28,"Hey, you with the weak email password, fix that!",-0.5064183473587036,Negative,English
2021-04-18,Peloton (PTON) - A Hardware or Software Play (Full DD),0.0,Neutral,English
2021-04-10,Concentration to growth - Difficult decision,0.0,Neutral,English
2021-03-31,"Get rich or die trying, margin trading!",0.0,Neutral,English
2021-03-12,Unable to enter option price in Chrome,0.0,Neutral,English
2021-02-25,What are your best DD/pick websites? Bookmark dump!,0.0,Neutral,English
2021-02-14,Robinhood UX & UI Discussion,0.0,Neutral,English
2021-01-24,Open Call for Applications - /r/Robinhood Community Manager,0.0,Neutral,English
2021-12-23,Looking for an automatic lot size calculator,0.0,Neutral,English
2021-12-21,Are there any platforms that work on MacOs or is this a losing battle?,0.0,Neutral,English
2021-12-28,Transitioning from accumulation phase to preservation phase,0.0,Neutral,English
2021-12-16,"Crosspost, FI Simulator that does not require giving someone access to your accounts",0.0,Neutral,English
2021-10-08,I crossed the finish line but the race wasn't over...,0.0,Neutral,English
2021-09-22,"My advice to myself after 15 years of actively trying to find a way, almost dying twice and overcoming homelessness after being a CEO",0.0,Neutral,English
2021-09-21,"Not FIRE, but 24 Years Old and Quit My Job to Travel the World. Here's My Story and Reasoning",0.0,Neutral,English
2021-09-20,The Luxury of a High Savings Rate; or Who's Afraid of Bonds?,0.0,Neutral,English
2021-09-19,What changes and what stays unchanged after hitting FI,0.0,Neutral,English
2021-09-18,A Net Worth of $1 million USD puts you in the top 1% of adults worldwide,0.0,Neutral,English
2021-09-01,10 year Not-So-Humblebrag,0.0,Neutral,English
2021-09-01,One accountant's journey to FIRE: 825k at 29 (725k liquid),0.7063219547271729,Positive,English
2021-08-31,"Aug 2021 monthly overview. 2 years into my job, 23yo, intensive spreadsheeting, high SR, <100k income",0.0,Neutral,English
2021-08-31,"Milestone $1 million invested, net worth ~$1.8, family of 4, without $100k/year jobs. Done in 2.5 years!",0.0,Neutral,English
2021-08-25,Thoughts Nearing the Finish Line,0.0,Neutral,English
2021-08-24,Just hit the 1M mark!,0.0,Neutral,English
2021-08-17,Sharing My FIRE Journey So Far (25M / USA ---> Hong Kong / Teacher / > 100K NW),0.0,Neutral,English
2021-08-16,Late 20s FIRE with slow travel,0.0,Neutral,English
2021-08-13,"$3.5M Invested, Goal Nearly Met | 33M & 33F w/ 1 Child | <2 Years to Go (Annual Update #4)",0.0,Neutral,English
2021-08-04,Hit CoastFIRE this week! More motivated than ever and what has helped me,0.711061418056488,Positive,English
2021-08-02,"If you make a decent income, it becomes all about lifestyle creep.",0.0,Neutral,English
2021-07-31,"494k at 27, and Slowing Down on FI",0.0,Neutral,English
2021-07-27,$1mm NW at 29 Software Sales FIRE Journey,0.0,Neutral,English
2021-07-17,Is there a correlation between pursuing FI/RE and CF (child-free lifestyle)?,0.0,Neutral,English
2021-07-10,"Road to FI..today I hit $1M in assets ($660k NW). Married 31M, 3 kids, NJ. Two salaries. Keep reading for the choices I made to get here!!",0.0,Neutral,English
2021-07-09,My half year 2021 financial update after over 10 years post FIRE,0.0,Neutral,English
2021-07-08,Six Months of Direct Indexing,0.0,Neutral,English
2021-07-08,My Fire Journey so Far (24M) 65k NW - 55k Income,0.0,Neutral,English
2021-07-06,First Quarterly Update / Q2 2021 / You gotta start somewhere,0.0,Neutral,English
2021-07-05,FIRE in one of the most expensive countries in the world as a 25yo couple.,-0.5106993317604065,Negative,English
2021-06-29,Part 2 of My Guide To Hedgefundie's Portfolio for FIRE/FatFire/WhaleFire,0.0,Neutral,English
2021-06-26,"28M - Just hit a third of a million in Sydney, Australia: Slow and steady",0.0,Neutral,English
2021-06-25,My Guide to Hedgefundie's Portfolio and Why I'm 100% Invested in it for FatFire and WhaleFire,0.0,Neutral,English
2021-06-16,Joining a tech company without coding / a small novel on the tech industry,0.0,Neutral,English
2021-06-14,"A New PF/FIRE Calculator - [Pre-RE, Post-RE, & Life Events on 1 Graph]",0.0,Neutral,English
2021-06-09,[32m/32f] My wife and I cross the 1.6M NW a couple weeks ago! Our journey,0.0,Neutral,English
2021-06-06,(36) Got a late start in life at 30 and more recently found FIRE. My backstory & journey so far to $1 million,0.0,Neutral,English
2021-06-06,A Purple Life - Really cool story & numbers (podcast episode),0.0,Neutral,English
2021-06-02,10 years after graduating. ~$775K NW. Military.,0.0,Neutral,English
2021-05-28,FOUR YEARS into early retirement from retail pharmacy,0.0,Neutral,English
2021-05-21,One more 1M+ $ guy from Europe :),0.0,Neutral,English
2021-05-15,FIRE and self-actualization,0.0,Neutral,English
2021-05-06,Could you be looking to FIRE because you are a workaholic? Take this test to find out!,0.0,Neutral,English
2021-04-25,The principles work.,0.0,Neutral,English
2021-04-24,"FIRE EU, Financial progress – Q1/2021 update",0.0,Neutral,English
2021-04-20,Debt-Free Millionaire at 31: The Dumb Way,0.0,Neutral,English
2021-04-18,My lessons toward FIRE: Hit $2.3M net worth at 52,0.0,Neutral,English
2021-04-18,Is it a horrible idea to share NW or portfolio with friends?,0.0,Neutral,English
2021-04-10,Should I baristaFIRE or go for a career change?,0.0,Neutral,English
2021-03-31,FI is making me feel even less motivated to get anything done - advice? Book recommendations?,0.0,Neutral,English
2021-03-19,"Changing career to tech, from the bottom of the field to $1.3M in Net Worth.",0.0,Neutral,English
2021-03-16,Reached my Number. Now I must wait for COVID to pass in order to pull the plug.,0.0,Neutral,English
2021-03-15,Post FIRE - 6 Month Report,0.0,Neutral,English
2021-03-14,FIRE-Focused Rent vs. Buy Calculator,0.0,Neutral,English
2021-03-12,I think I just FIREd,0.0,Neutral,English
2021-03-09,Official 2020 FI Survey Results,0.0,Neutral,English
2021-03-06,"Mega Backdoor Roth, In-Plan Conversions",0.0,Neutral,English
2021-02-07,Reached $100k NW,0.0,Neutral,English
2021-01-25,Today is the 3rd day of the rest of my life! Retired last week thanks to FIRE,0.0,Neutral,English
2021-01-12,"Two ex-Sequoia VCs: the most ‘compelling emerging market’ may be America, outside of Silicon Valley",0.0,Neutral,English
2021-11-01,Tim Cook wants Facebook dead and his strategies are working,0.0,Neutral,English
2021-09-09,Long Thesis on OPRA ( OPRA limited),-0.9709440469741821,Negative,English
2021-09-06,A Commentary on Why Tech Stocks are Expensive,0.0,Neutral,English
2021-07-27,Tiger Global: the technology investor ruffling Silicon Valley feathers,0.0,Neutral,English
2021-05-27,Why Shorting Support.com (SPRT) Might be a Bad Idea,-0.5304669737815857,Negative,English
2021-04-30,ASML - When does a monopoly become too expensive?,-0.4119418263435364,Negative,English
2021-04-28,Enjoy Technology Going Public,0.0,Neutral,English
2021-04-16,"QUANTUMSCAPE (NYSE: QS) A Pump and Dump SPAC Scam By Silicon Valley Celebrities, That Makes Theranos Look Like Amateurs from Scorpion Capital",0.0,Neutral,English
2021-02-04,"Apple, Its Control Over the iPhone, The Internet, And The Metaverse",0.0,Neutral,English
2021-01-21,Greenlane Renewables (GRN) - Great growth stock in renewable energy or an overhyped disaster??,0.0,Neutral,English
2021-01-10,AFRM: Another Underpriced IPO Worth Looking At,0.0,Neutral,English
2021-01-06,Special Situation: Yorkey Optical HK$2788,-0.565680980682373,Negative,English
2021-01-04,Deep Dive Research About a Collaborative Work Management Company Poised to Benefit off the Remote Work Trend. NYSE Listed.,0.0,Neutral,English
2021-10-21,Learn About Borqs Technologies (NASDAQ: BRQS) in Exclusive Zoom Investor Group Call,0.0,Neutral,English
2021-08-25,Investing in apple vs Microsoft,0.0,Neutral,English
2021-07-28,Tiger Global: the technology investor ruffling Silicon Valley feathers,0.0,Neutral,English
2021-06-09,Roku Overview and Brief Bear/Bull Case,0.0,Neutral,English
2021-05-04,$SKLZ Skillz Stock Earnings Headlines and Takeaways,0.9393750429153442,Positive,English
2021-01-20,Growth stocks to hold for the next 5-10+ years?,0.0,Neutral,English
2021-12-23,How Tim Cook Crushed Facebook—and Set up a War in Tech for Years to Come,0.0,Neutral,English
2021-12-14,This is the implication of the commercials about society’s current regard for “innovation”.,-0.7192374467849731,Negative,English
2021-12-13,"Great Protocol Politics — The 21st century doesn’t belong to China, the United States, or Silicon Valley. It belongs to the internet.",0.0,Neutral,English
2021-12-10,It seems like nobody is embracing real innovation and would rather live in the 1970s or something from all these commercials you see.,0.0,Neutral,English
2021-11-19,The Millennium Project: How can everyone have sufficient clean water without conflict?,0.0,Neutral,English
2021-11-01,Time to get paid for our DATA?,0.0,Neutral,English
2021-10-26,Watch: Dragon scale solar tiles installed on Google buildings in Silicon Valley - company installs 'building integrated photovoltaic' solar panels that look like a normal roofing product that competes with Tesla's Solar Glass,0.0,Neutral,English
2021-09-23,"EU proposes mandatory USB-C on all devices, including iPhones",0.0,Neutral,English
2021-09-21,Silicon Valley’s quest to live forever could benefit humanity as a whole — here’s why - A growing number of tech billionaires have decided they want to use their enormous wealth to try and help humans “cheat death.”,0.6891972422599792,Positive,English
2021-09-21,Silicon Valley’s quest to cure major diseases of an aging population by targeting its biology could benefit humanity as a whole — here’s why | CNBC,0.0,Neutral,English
2021-09-18,Want to save the Earth? Then don’t buy that shiny new iPhone.,0.0,Neutral,English
2021-09-18,Cheap Sensors for Smarter Farmers - Two IoT sensors from this year's ARPA-E Summit can help farmers make better decisions,0.762188196182251,Positive,English
2021-09-17,Why Silicon Valley's optimization mindset sets us up for failure.,0.0,Neutral,English
2021-09-16,Who wants to live for ever? Jeff Bezos and Mark Zuckerberg do - Silicon Valley’s billionaires are ploughing a fortune into tech to keep them ticking | The Times,0.0,Neutral,English
2021-09-04,"Meet Altos Labs, Silicon Valley’s latest wild bet on living forever",0.0,Neutral,English
2021-08-26,"The iPhone 13's Face ID Will Support Face Masks, Leaker Says | Digital Trends",0.0,Neutral,English
2021-08-17,Researchers from the Indian Institute of Technology Jodhpur (IIT-Jodhpur) have developed an improvised version of a blockchain technology that is computationally lighter and both energy and time efficient allowing its application for making secure communication in IoT networks,0.0,Neutral,English
2021-08-14,Right to Repair aftermath thoughts,0.0,Neutral,English
2021-08-11,Can blood from young people slow aging? Silicon Valley has bet billions it will,0.0,Neutral,English
2021-08-05,Apple plans to scan US iPhones for child abuse imagery,0.0,Neutral,English
2021-07-22,"Building robots like lego: 6-yr-old Silicon Valley robotics company says its 200+ hardware + software modules make robot development 10x Faster, 10x Cheaper",0.0,Neutral,English
2021-07-20,"Hi Reddit! I’m Andy Stanford-Clark, CTO at IBM UK and leading the IBM technical team for the Mayflower Autonomous Ship, a first-of-its-kind un-crewed vessel. Ask me anything and I’ll be here in r/futurology to answer your questions on July 21st at 4PM UTC/5PM BST/12PM EST/9AM PT!",0.0,Neutral,English
2021-06-27,"Silicon Valley is trying to 'cure' old age. Is that a good idea? Life extension may be on the precipice of becoming ""the biggest industry on earth""",0.0,Neutral,English
2021-06-07,Just thinking,0.0,Neutral,English
2021-06-03,"“Dying for an iPhone”: The suffering of the working class, within and outside the United States, is ignored by our corporatized media, and yet, it is one of the most important human rights issues of our era.",0.0,Neutral,English
2021-06-01,Injustice against the future,0.0,Neutral,English
2021-05-30,The bizarro “future” which isn’t the future (from a ‘90s perspective),0.0,Neutral,English
2021-05-28,The Participatory Evaluation (of) Aging (with) Rapamycin (for) Longevity Study AMA,0.0,Neutral,English
2021-05-24,"Silicon Valley Wants Dogs to Live Longer So Humans Can, Too",0.0,Neutral,English
2021-05-24,The Costly Pursuit of Self-Driving Cars Continues On. And On. And On. Many in Silicon Valley promised that self-driving cars would be a common sight by 2021. Now the industry is resetting expectations and settling in for years of more work.,0.0,Neutral,English
2021-05-08,Universal basic income is here—it just looks different from what you expected. How the pandemic took the concept of universal basic income out of Silicon Valley’s hands—and turned it into something far more radical.,0.0,Neutral,English
2021-05-04,Opinion | The Pentagon has stopped laughing about UFOs. Why hasn't Silicon Valley?,0.0,Neutral,English
2021-05-03,"Will the Fourth Industrial Revolution Serve Sustainability? by Victor Galaz - This upheaval – which also reflects the impact of robotics, bio- and nanotechnology, 5G, and the Internet of Things (IoT) – is a general-purpose revolution.",0.0,Neutral,English
2021-04-27,Do you people think we will see more rapid changes from 2020 - 2030 than 2000 - 2020 ? What are the changes you are looking for ?,0.0,Neutral,English
2021-04-22,Navigating a Digital Planet: Why Students can Never Know Enough Technology,0.0,Neutral,English
2021-04-22,Samsung Allows You To Turn an Old Galaxy Phone Into a New IoT Device,0.0,Neutral,English
2021-04-21,"Introducing Satellite: The social network we've been waiting for. ""A universal social network, owned by everyone"". Thrilling interview about the philosophy behind the decentralized platform which offers users an exit from the silicon valley monopoly. Watch it now on Satellite.",0.0,Neutral,English
2021-04-15,Obsolete every day carry (EDC): cash and watches are dying out - what could be next?,0.0,Neutral,English
2021-04-12,Researchers develop way to use over-capacity of 5G networks as “wireless power grid” for powering IoT devices that need batteries to operate. It uses a flexible Rotman lens-based rectifying antenna (rectenna) system capable of millimeter-wave harvesting in the 28-GHz band.,0.0,Neutral,English
2021-04-07,Can Blood from Young People Slow Aging? Silicon Valley Has Bet Billions It Will,0.0,Neutral,English
