Date,Title,Score,Sentiment,Language
2024-03-12,"44M, career teacher, $1.2MM - what should I be doing money wise right now and approaching retirement? Help!",0.0,Neutral,English
2024-03-04,One accountant's journey to FIRE: 1.1m at 32 (0.9m liquid),0.0,Neutral,English
2024-03-02,I finally hit 155k net worth in a HCOL area at 30.5 yrs old. ,0.0,Neutral,English
2024-03-02,Is there ever a reason to slow down your investing into retirement accounts?,0.0,Neutral,English
2024-02-28,BigLaw Associates of r/financialindependence: What's Your Plan?,0.0,Neutral,English
2024-02-27,Help me model my expense,0.0,Neutral,English
2024-02-23,The personality of FIRE vs the math. A small case study. ,0.0,Neutral,English
2024-02-22,Five Year Update: 42 y/o FIREd,0.0,Neutral,English
2024-02-12,FI/RE 6 years in - yearly update + musings,0.0,Neutral,English
2024-02-10,"Hit FI target and milestone birthday! $2.3M + home equity, 40F",0.0,Neutral,English
2024-02-09,Am I close to RE? 38M with 2.6MM NW,0.0,Neutral,English
2024-02-08,Leaving stock portfolio as inheritance for kids,0.0,Neutral,English
2024-02-06,How do you determine your 3 portfolio allocation?,0.0,Neutral,English
2024-02-03,"Canadian in Toronto feeling stuck, how do I (30M) accelerate my path to FIRE?",0.0,Neutral,English
2024-02-01,Journey to 750k at 30 in a nonprofit/writing career,0.0,Neutral,English
2024-01-18,"Burnt out at work, feel so close but so far away",-0.5220897197723389,Negative,English
2024-01-17,"We saved our first $100,000!",0.0,Neutral,English
2024-01-14,Sample Retirement Budget,0.0,Neutral,English
2024-01-08,Career Break While Still Working Towards FIRE,0.0,Neutral,English
2024-01-06,10-year FIRE Progress ($1.95M @ 32) - Kids Changing the Plan,0.0,Neutral,English
2024-01-02,24M One Year Post Grad Review + Living at Home,0.0,Neutral,English
2024-01-01,"My year in review. A wild career ride, from employed to CoastFIRE to employed again.",0.0,Neutral,English
2024-01-01,13 Years post FIRE update,0.0,Neutral,English
2024-08-23,'The time has come' to lower interest rates: Fed Chair Jerome Powell,0.0,Neutral,English
2024-10-28,Changes to analyst estimates data,0.0,Neutral,English
2024-10-26,Interesting Analysis on Obscure Smallcap,0.0,Neutral,English
2024-10-22,Q3 2024 Letters & Reports,0.0,Neutral,English
2024-07-09,Q2 2024 Letters & Reports,0.0,Neutral,English
2024-05-06,The ultimate buyback plan — Berkshire Hathaway,0.0,Neutral,English
2024-04-17,"Silicon Labs vs Nordic Semi, the battle for the IoT semiconductor market",0.0,Neutral,English
2024-01-12,Q4 2023 Letters & Reports,0.0,Neutral,English
2024-12-31,Can’t pass my evals ,0.0,Neutral,English
2024-12-31,Time Intervals and Highs/Lows,0.0,Neutral,English
2024-12-31,help me not become liquidity,0.0,Neutral,English
2024-12-31,Robotics Stocks is About to Take Over ,0.0,Neutral,English
2024-12-30,Stock Market Today: Nvidia Locks In $700M AI Play + Jeju Air Tragedy Sends Shockwaves Through Aviation,-0.9594674110412598,Negative,English
2024-12-30,"⏰ The market’s ready to play—here’s what’s coming your way (Dec 30, 2024):",0.0,Neutral,English
2024-12-30,The Dawn of an AI Explosion: Six Exciting Breakthroughs for the Next Decade!,0.0,Neutral,English
2024-12-29,Best trading platform? ,0.0,Neutral,English
2024-12-29,[ORB Strategy] December Results,0.0,Neutral,English
2024-12-27,Quantvue Q Line indicator?,0.0,Neutral,English
2024-12-27,I have collated all the significant news this morning from the Bloomberg terminal and have included it all in this summarised post. ,0.9207437634468079,Positive,English
2024-12-26,Day trading laptop,0.0,Neutral,English
2024-12-26,Need to keep track of my trades,0.0,Neutral,English
2024-12-25,Day trading on iOS - Tradestation,0.0,Neutral,English
2024-12-25,"No market replay data available for any stock or index on ninjatrader? i tried amd, googl, aapl nothing is working...",0.0,Neutral,English
2024-12-25,Extreme greed made me lose a month of gains ,-0.8059996962547302,Negative,English
2024-12-24,What Method Should I Trade.,0.0,Neutral,English
2024-12-21,Mag 7 traders,0.0,Neutral,English
2024-12-21,Honest Question - Is this sustainable? ,0.0,Neutral,English
2024-12-21,Help needed,0.0,Neutral,English
2024-12-20,"Posted a few weeks ago, still going strong…",0.0,Neutral,English
2024-12-19,How to handle new info in middle of trade,0.0,Neutral,English
2024-12-19,Watchlist 12/20,0.0,Neutral,English
2024-12-18,"If you are trader, or want to start trading must read :",0.0,Neutral,English
2024-12-17,Stock Market Today: Honda and Nissan Might Merge to Take on the Big Dogs + Dow’s Nine-Day Slide — Is It Really That Bad?,-0.9647271037101746,Negative,English
2024-12-16,Stock Market Today: Drones Are Soaring on Wall Street + Bitcoin Hits $107K,-0.7833175659179688,Negative,English
2024-12-16,Watchlist 12/16,0.0,Neutral,English
2024-12-14,10k/8k Reporting,0.0,Neutral,English
2024-12-13,Stock Market Today: Buzzfeed Sells First We Feast (Hot Ones) + YouTube TV Raises Prices Again,-0.9615974426269531,Negative,English
2024-12-12,"Stock Market Today: ServiceTitan Shares Soar 42% in Blockbuster IPO + Earnings From Broadcom, Costco & Adobe",-0.9683194756507874,Negative,English
2024-12-12,Backtesting options,0.0,Neutral,English
2024-12-12,"Premarket report 12/12, after PPI comes slightly hot. All the news here is collated from the Bloomberg Terminal for best accuracy.",0.5924371480941772,Positive,English
2024-12-11,Stock Market Today: Amazon Adds 'Car Shopping' to Its Cart + Apple’s AI Ambitions Take Shape with Broadcom Partnership,0.5947052836418152,Positive,English
2024-12-11,Apple’s New Moves and Updates On $490M Investor Settlement,0.0,Neutral,English
2024-12-11,Mac Trading - CPU/GPU or ram? ,0.0,Neutral,English
2024-12-10,Watchlist 12/10,0.0,Neutral,English
2024-12-10,Stock Market Today: Google’s Quantum Chip Willow Stuns the World  + Oracle's Cloudy Day + Inflation — Still Hanging Around Like That Guest Who Won’t Leave,-0.9614450335502625,Negative,English
2024-12-09,Who else here trade wyckoff? I need yall help!,0.0,Neutral,English
2024-12-09,"This Week in Markets (Dec 9th): Nvidia Stumbles, Retail Surges, & The Fed Keeps Us Guessing",-0.6957669854164124,Negative,English
2024-12-09,Friend is using his payout for trading lessons,0.0,Neutral,English
2024-12-09,Stock Market Today: China Opens Probe Into Nvidia + Mondelez Takes Another Bite at Hershey,-0.9577586054801941,Negative,English
2024-12-09,I made my second trade today. I have questions!,0.0,Neutral,English
2024-12-09,"I'm a full time trader and this is everything I'm watching and analysing in premarket 09/12 as China shifts their monetary policy to ""moderately Loose', sending Chinese equities higher. ",0.5118579268455505,Positive,English
2024-12-07,How is your journey going? Just wanted to share my 1/2year progress.,0.0,Neutral,English
2024-12-06,"Stock Market Today: Lululemon’s Comeback Stretch, Biggest Surge Since 2008 + Chrysler: Once an Icon, Now Running on Empty",0.5733105540275574,Positive,English
2024-12-05,"How can I make this chart easier to read? As a day trader/scalper, any tips on other windows or setups? I’ve traded on IBKR for years and recently moved an account to DAS. I’m trying to simplify the chart to match the clean look of IBKR. Any advice on improving readability is appreciated. Thanks! :)",0.0,Neutral,English
2024-12-05,"PREMARKET REPORT 05/12 - Catch up on all the market moving news in premarket across earnings, macro, stocks and more in one place. All the news here is collated from the Bloomberg Terminal for best accuracy.",-0.8234475255012512,Negative,English
2024-12-04,Best trading platforms,0.0,Neutral,English
2024-12-04,Apple Stock Analysis,-0.9513601064682007,Negative,English
2024-12-04,Stock Market Today: Salesforce Goes All In on AI + China Hits Back At U.S. With Export Ban On Rare Minerals,0.9446813464164734,Positive,English
2024-12-03,Foreshadowing? ,-0.5238438248634338,Negative,English
2024-12-03,Triangles.,0.0,Neutral,English
2024-12-03,Stock Market Today: BlackRock Hops On The Private Credit Train + Apple Accused Of Snooping On Workers’ iPhones In New Lawsuit,-0.7557932734489441,Negative,English
2024-12-02,IBKR compliance check: does anyone have any experience on that?,-0.5095329880714417,Negative,English
2024-12-02,"trading, is it worth it?",0.0,Neutral,English
2024-12-01,oops I did it again ($2000 month),0.0,Neutral,English
2024-12-01,Analyzing Key Levels for Monday: Tesla (TSLA) and Nvidia (NVDA),0.0,Neutral,English
2024-11-30,Analyze my Psychology/Risk Management Blueprint for Scalping for every day of the month ,0.0,Neutral,English
2024-11-28,Tips to make this strategy more profitable?,0.0,Neutral,English
2024-11-28,Advice needed: How do you pick stocks?,0.0,Neutral,English
2024-11-27,Stock Market Today: Intel Snags $7.9B Grant to Expand U.S. Chipmaking + Walmart Steps Back from DEI Efforts,-0.966460645198822,Negative,English
2024-11-27,Does anyone use Stox.io scanner?,0.0,Neutral,English
2024-11-27,Help me understand what’s the estimated credit is plz and should I keep the stock or sell I’m new to this,0.0,Neutral,English
2024-11-26,If it's too good to be true...,-0.5557123422622681,Negative,English
2024-11-26,📊 Nifty 50 Sector Insights: What's Driving the Market?,0.0,Neutral,English
2024-11-25,Trigger alerts PM & AH? Anyone?,0.0,Neutral,English
2024-11-25,I don't think I will ever have the balls to go full time,-0.9313952922821045,Negative,English
2024-11-23,Am I on the right path to Intraday Trading?,0.0,Neutral,English
2024-12-31,Two Stocks You Should Keep An Eye On👀,0.9369123578071594,Positive,English
2024-12-30,Premarket report 30/12 - I'm a professional trader and this is everything I'm watching and analysing in premarket as bullish Robotics news comes out of NVDA which is not yet being priced into the stock in premarket. All the news here is collated from the Bloomberg Terminal for maximum accuracy.,0.0,Neutral,English
2024-12-30,"Complete investment thesis on UBER, a top pick into 2025. This post focuses on the fundamentals, institutional flow, technicals, positioning and more. Here we look at why institutions are loading up on this company big time heading into 2025.",-0.7511947751045227,Negative,English
2024-12-19,"I'm a professional trader and this is everything I'm watching and analysing in premarket 19/12 after the FOMC meeting, including a review of MU earnings. All news posted here is taken directly from the Bloomberg terminal to ensure maximum accuracy.",0.0,Neutral,English
2024-12-16,I'm a professional trader and this is everything I;m watching and analysing in premarket 16/12 as Nasdaq rebalances and BTC pumps over the weekend. All the news here is collated from the Bloomberg Terminal for best accuracy.,0.0,Neutral,English
2024-12-12,I'm a professional trader and this is everything I;m watching and analysing in premarket 12/12 as PPI comes in slightly hot. All the news here is collated from the Bloomberg Terminal for best accuracy.,0.0,Neutral,English
2024-12-11,I'm a professional trader and this is everything I;m watching and analysing in premarket 11/12 as Core CPI comes in slightly hot. ,0.0,Neutral,English
2024-12-09,"I'm a professional trader and this is everything I'm watching and analysing in premarket 09/12, including a look at China, Syria, TSLA & NVDA. All the news here is collated from the Bloomberg Terminal for best accuracy.",0.0,Neutral,English
2024-12-05,"I'm a professional trader and this is everything I'm watching and analysing in premarket 05/12 as BTC breaks 100k, sending crypto stocks ripping in premarket. ",0.0,Neutral,English
2024-12-03,"PREMARKET REPORT 03/12 - Catch up on all the market moving news in premarket across forex, macro, stocks and more in one place. All the news here is collated from the Bloomberg Terminal for best accuracy.
",0.0,Neutral,English
2024-12-03,"[MEGA POST] Tech stocks have underperformed after Turmp's victory. But strong price action today and breakout across multiple Mag7 charts will create positive performance going forward. Big Tecfh is a clear buy not Sell. Positioning & technical analysis included for META, MSFT, AAPL, TSLA.
",0.9448328614234924,Positive,English
2024-12-03,Today’s Breakout Watch,0.9530407786369324,Positive,English
2024-12-01,$AAPL - trade idea ,0.0,Neutral,Catalan
2024-12-01,"The Most Anticipated Earnings Releases for the Week of December 2, 2024",0.0,Neutral,English
2024-11-25,Watchlist: $AAPL,0.7244497537612915,Positive,English
2024-11-25,PREMARKET REPORT 25/11 - I'm a professional trader and this is everything I'm watching and analysing ahead of the trading day as we kick off thanksgiving week,0.0,Neutral,English
2024-11-19,I'm a professional trader and this is everything I'm analysing in premarket 19/11 as Ukraine launches the first ATACMS attack. ,0.0,Neutral,English
2024-11-19,"SQ being hit with massive flow, as it sits in an attractive cross section of Fintech and Crypto. Technicals strong. Here's more on the fundamentals.",0.8552768230438232,Positive,English
2024-11-17,Mag 7 - Technical Analysis - 11/17/2024,0.0,Neutral,English
2024-11-17,Fintech - Reviewing institutional flow and positioning on this sector that has shown great relative strength through market weakness last week. ,0.0,Neutral,English
2024-11-13,"I'm a professional trader, and  Whilst I remain bullish over next year, signs are there for caution now as headwinds build. Rotating more into cash, will buy dip if it comes. Here's my detailed explanation of why. ",0.0,Neutral,English
2024-11-13,Understand that dollar being this strong is a headwind as it reduces liquidity from equity markets. Here's why.,0.0,Neutral,English
2024-11-12,"I'm a professional trader and this is everything I'm watching and analysing in premarket 11/12
",-0.9267169237136841,Negative,English
2024-11-11,Options with strong volume,0.0,Neutral,English
2024-11-07,I'm a professional trader and this is everything I'm watching and analysing in premarket 07/11 ahead of the FOMC meeting today. Everything you need to know in one 5 minute read.,0.0,Neutral,English
2024-11-05,I'm a professional trader and this is everything I'm watching and analysing in premarket 05/11 ahead of the US election. Everything you need to know in one 5 minute read.,0.0,Neutral,English
2024-11-04,I'm a professional trader and this is everything I'm watching and analysing in premarket 04/11 ahead of the US election. Everything you need to know in one 5 minute read. ,0.0,Neutral,English
2024-11-01,These are the stocks on my watchlist (11/1)  ,0.0,Neutral,English
2024-11-01,"I'm a profesional trader and this is everything I'm watching and analysing in premarket, including a detailed breakdown of AMZN & AAPL earnings reports with my key takeaways",0.0,Neutral,English
2024-10-31,"I am working on a data platform that will give you access to option data that is normally reserved for institutions. Best thing is, I will be releasing for free and covering the data costs myself. See r/Tradingedge (my sub) for more. ",0.0,Neutral,English
2024-10-31,These are the stocks on my watchlist (10/31),0.0,Neutral,English
2024-10-29,"I'm a professional trader and this is everything Im watching and analysing in premarket. Including a detailed breakdown of all the major earnings report as well as any other market moving news that you should know. I spent hours on this, so I hope you enjoy.",0.0,Neutral,English
2024-10-29,"DETAILED BIG TECH EARNINGS PREVIEW FROM A PROFESSIONAL TRADER - Including Fundamental, Technical and Positioning analysis",0.0,Neutral,English
2024-10-28,"I'm a full time trader and this is everything I have read, digested and analysed from hours of premarket reading all condensed into one 5 minute read. EDUCATIONAL MATERIAL INCLUDED ON HOW TO TRADE EARNINGS LIKE A PROFESSIONAL.",0.0,Neutral,English
2024-10-27,"The Most Anticipated Earnings Releases for the Week of October 28, 2024",0.0,Neutral,English
2024-10-25,"I'm a professional trader and this is everything I'm watching and analysing in premarket 25/10, all summarised into a short 5 minute read for you to catch up ahead of the day.",0.0,Neutral,English
2024-10-23,I'm a professional trader and this is all my research and notes from premarket 23/10 including detailed summaries and interpretation of all the major earnings reports. Hope it helps!,0.0,Neutral,English
2024-10-22,"I'm a professional trader and this is everything I'm watching and analysing in premarket 22/10, including detailed breakdown of all the earnings reports, analyst upgrades and downgrades, market moving news and some Forex analysis. All you will need!",0.0,Neutral,English
2024-10-21,These are the stocks on my watchlist (10/21),0.0,Neutral,English
2024-10-21,"I'm a professional trader and this is everything I'm watching and analysing after hours of premarket research, all collated into one precise 5 minute read. 21/10",0.0,Neutral,English
2024-10-18,These are the stocks on my watchlist (10/18),0.0,Neutral,English
2024-10-18,"18/10 - PREMARKET REPORT. ALL THE NEWS TO CATCH YOU UP ON EVERYTHING I'm WATCHING AND READING IN PREMARKET, IN ONE 5 minute READ FOR YOU TO PERUSE OVER YOUR MORNING COFFEE.",0.0,Neutral,English
2024-10-17,"I'm a professional trader and this is everything I'm watching and analysing in premarket, 17/10, including a look at TSM earnings and the implications, a look at jobless claims expectations and more. ",0.0,Neutral,English
2024-10-16,"I'M A FULL TIME TRADER AND THIS IS EVERYTHING IM WATCHING AND ANALYSING IN PREMARKET ACROSS MACRO, FX, EARNINGS REPORTS, COMPANY SPECIFIC AND GENERAL ECONOMIC NEWS MOVING MARKETS TODAY.",-0.9633594155311584,Negative,English
2024-10-15,"I'm a professional trader and this is everything I'm watching and analysing in premarket all summarised into one 5 minute read. Covers detailed analyst reports, macro news, earnings summaries, FX and more.",0.0,Neutral,English
2024-10-10,"I'm a professional trader and this is everything I'm watching and analysing in premarket ahead of CPI, TSLA's Robotaxi event and AMD's AI event. All summarised for you in one short 5 minute read.",0.0,Neutral,English
2024-10-09,My Watchlist: Sector Rotation,-0.6816239356994629,Negative,English
2024-10-07,I'M A PROFESSIONAL TRADER AND THIS IS EVERYTHING I'm READING AND WATCHING IN PREMARKET ALL SUMMARISED INTO ONE 5 MINUTE READ. INCLUDING ANALYST UPGRADES & MORE.,0.0,Neutral,English
2024-10-03,"I'm a professional trader and this is  Everything I'm wtaching and analysing in premarket, all summarised into one short 5 minute read. ",0.0,Neutral,English
2024-10-02,"I'm a professional trader and this is Everything I'm watching and analysing in premarket 02/10, all summarised in one 5 minute report. Incldues geopoltiics, FX and more. ",0.0,Neutral,English
2024-10-01,These are the stocks on my watchlist (10/1),0.0,Neutral,English
2024-10-01,"I'm a professional trader and this is everything I'm watching and reading in premarket, all summarised in one 5 minute read for you to peruse over your morning coffee.",-0.5067899823188782,Negative,English
2024-09-29,Swing Trade Idea: Apple Inc. (AAPL),0.0,Neutral,English
2024-09-26,PREMARKET REPORT 26/09 - I'm a professional trader and this is everything you need to know in premarket as China pumps the stimulus again. All summarised in a 5 minute read for you to peruse over your coffee.,0.9328606128692627,Positive,English
2024-09-25,"25/09 - DAILY PREMARKET REPORT. All the news, analyst ugprades and everything you need to know in one 5 minute read. ",0.0,Neutral,English
2024-09-24,"Premarket Report 24/09 as we see big stimulus from China. This is a round up of all the premarket news, for you to get caught up on everything premarket, in just one 5 minute read.",-0.4676845371723175,Negative,English
2024-09-21,Week 39 - 9/23/24 - 9/27/24 - Weekly Discussion Thread,0.0,Neutral,English
2024-09-21,Friday was the biggest S&P index rebalancing in four years (Marketwatch),-0.9006154537200928,Negative,English
2024-09-17,These are the stocks on my watchlist (9/17),0.0,Neutral,English
2024-09-16,These are the stocks on my watchlist (9/16),0.0,Neutral,English
2024-09-15,Week 38 - 9/16/24 - 9/20/24 - Weekly Discussion Thread,0.0,Neutral,English
2024-09-10,These are the stocks on my watchlist (9/10),0.0,Neutral,English
2024-08-29,"Despite the drop, AI thinks NVIDIA is a 5/5. Do you agree or disagree with their analysis? ",0.0,Neutral,English
2024-08-27,"What do your ""setups' look like exactly?",0.0,Neutral,English
2024-08-25,Watching; AAPU (AAPL),0.0,Neutral,English
2024-08-21,Sector and Industry ,0.0,Neutral,English
2024-08-18,Week 34 - 8/19/24 - 8/23/24 - Weekly Discussion Thread,0.0,Neutral,English
2024-08-13,This trading platform uses AI to help you find novel investing opportunities,0.0,Neutral,English
2024-08-06,"V COMPREHENSIVE: We saw strong reversal yday, but As I mentioned, Markets will likely remain under pressure until OPEX still. Some fast squeeze bounces like yday, but overall still likely to be pressured. Heres a look at positioning, skew, & the Japanese influence with KEY new data out yday, & more.",0.0,Neutral,English
2024-08-04,Week 32 - 8/5/24 - 8/9/24 - Weekly Discussion Thread,0.0,Neutral,English
2024-08-02,These are the stocks on my watchlist (8/2),0.0,Neutral,English
2024-08-01,These are the stocks on my watchlist (8/1),0.0,Neutral,English
2024-07-28,"The Most Anticipated Earnings Releases for the Week of July 29, 2024",0.0,Neutral,English
2024-07-27,"Beginning trader and I want it all! (all the right tools, that is).",0.0,Neutral,English
2024-07-24,These are the stocks on my watchlist (7/24),0.0,Neutral,English
2024-07-23,"I'm a professional trader and this is everything I'm watching and analysing in premarket 23/07. includes summary of all the earnings reports, analysis and education, and all the news from premarket.",0.0,Neutral,English
2024-07-22,These are the stocks on my watchlist (7/22),0.0,Neutral,English
2024-07-22,I'm a professional trader and this is everything I'm watching and analysing in premarket 22/07 after Biden dropped out of presidential running. ,-0.8280910849571228,Negative,English
2024-07-19,"I'm a professional trader and this is Everything I'm watching and analysing in premarket 19/07 including CRWD outage, (NOT MSFT OUTAGE), NFLX earnings, ISRG earnings, AXP earnings, and all other news.",0.0,Neutral,English
2024-07-16,These are the stocks on my watchlist (7/16),0.0,Neutral,English
2024-07-15,"I'm a professional trader and this is Everything I'm watching and analysing in premarket 15/07 after Trump assassination attempt over the weekend. All the news from premarket, including analyst upgrades and downgrades.",0.0,Neutral,English
2024-07-12,"I'm a professional trader and this is everything I'm watching and analysing in premarket after traders rotate out of Mag7 and into IWM. Here's where they are positioned now, post CPI. ",0.0,Neutral,English
2024-07-11,Does anybody here only trade the top safe companies because you don't have time to search for stocks?,0.0,Neutral,English
2024-07-11,I'm a professional trader and this is everything I'm watching and analysing in premarket ahead of cpi. All the market moving news,-0.7860590219497681,Negative,English
2024-07-10,These are the stocks on my watchlist (7/10) ,0.0,Neutral,English
2024-07-10,"I'm a full time trader and this is everything I'm watching and analysing in premarket, including analysis pre CPI, Some set ups to watch, all the market moving news and summaries of analyst upgrades and downgrades [FULL REPORT]",0.0,Neutral,English
2024-07-09,These are the stocks on my watchlist (7/9) ,0.0,Neutral,English
2024-07-09,"I'm a professional trader and this is Everything I'm watching and analysing in premarket 09/07 including all the news moving the markets, and a look at CPI, VIX, NVDA and more",0.0,Neutral,English
2024-07-08,These are the stocks on my watchlist (7/8),0.0,Neutral,English
2024-07-07,I created a free library of market-beating trading strategies,-0.6100455522537231,Negative,English
2024-07-05,"I'm a full time trader and this is Everything I'm watching and analysing in premarket, ahead of the NFP data out soon",0.0,Neutral,English
2024-07-02,Week 27 - 7/1/24 - 7/5/24 - Weekly Discussion Thread - Midweek Update,0.0,Neutral,English
2024-06-20,I'm a full time trader and this is everything I'm watching and analysing in premarket 20/06 as SPX trades above 5500,0.9462811350822449,Positive,English
2024-06-18,These are the stocks on my watchlist (6/18) ,0.0,Neutral,English
2024-06-18,"I'm a professional trader and this is everything I'm watching and analysing in premarket 18/06 ahead of retail sales, including positioning analysis on various stocks and commodities. ",0.0,Neutral,English
2024-06-14,"I'm a full time trader and this is everything I'm watching and analysing in premarket 14/06 including a look at positioning, NVDA, AMZN, BOJ, Tesla shareholder meeting and ADBE earnings. ",0.0,Neutral,English
2024-06-13,These are the stocks on my watchlist (6/13),0.0,Neutral,English
2024-06-13,I'm a professional trader and this is everything I'm watching and analysing in premarket ahead of PPI later. ,0.0,Neutral,English
2024-06-11,These are the stocks on my watchlist (6/11) ,0.0,Neutral,English
2024-06-11,I'm a full time trader and this is everything i'm watching and analysing in premarket including all the news and all my expectations for the day ahead of FOMC and CPI tomorrow. ,0.0,Neutral,English
2024-06-10,"I'm a full time trader and this is everything I'm watching and analysing in premarket 10/06, including expectations for the week ahead, coverage on EU elections and more. ",0.0,Neutral,English
2024-06-07,"I'm a full time trader and this is everything I'm watching and analysing ahead of NFP today, including all my expectations for the day and what the positioning data tells us about where the market will go. ",-0.764732301235199,Negative,English
