Date,Title,Score,Sentiment,Language
2021-06-25,Optimizing IBKR API TIme and Sales Extractions,0.0,Neutral,English
2021-06-22,"Has anyone used Kats yet, Facebook's Python time series analysis toolkit?",0.0,Neutral,English
2021-06-20,Any historical datasets that do not need data cleaning?,0.0,Neutral,English
2021-06-18,Paid Fundamental Data: AlphaVantage vs Finnhub.io,0.0,Neutral,English
2021-06-13,Binance Full (or atleast sufficiently deep) Orderbook,0.0,Neutral,English
2021-06-12,"I made an algo that tracks sentiment on Reddit (and trades those stocks). Here's the source code and the sentiment results for this week. I rebalance weekly, but can set rebalance speed to as fast as a couple ticks (although that would be a bit silly)",0.0,Neutral,English
2021-06-10,"""Scalping""?",0.0,Neutral,English
2021-06-06,Obtaining VWAP from IEX Cloud?,0.0,Neutral,English
2021-06-03,Differences in market data and stock market confusion,0.0,Neutral,English
2021-06-02,Determine market and ice-berg order types from live trade and quote data,0.0,Neutral,English
2021-06-02,binance book depth stream for non btc/eth pairs,0.0,Neutral,English
2021-06-01,More Market Data Available on DoltHub,0.0,Neutral,English
2021-05-31,Speeding Up the Fitting of SVI Volatility Surface Python,0.0,Neutral,English
2021-05-25,Binance Technical Indicator Data,0.0,Neutral,English
2021-05-20,Best Crypto Trading Bots 2021 (Medium article),0.0,Neutral,English
2021-05-15,TDA API for Forex,0.0,Neutral,English
2021-05-15,Has anyone compared the performance of Polygon.io versus IEXCloud?,0.0,Neutral,English
2021-05-14,What's the best API for fundamentals data from the last 15-20 years?,0.0,Neutral,English
2021-05-11,My hard way to learn EMA's formula and deep dive of EMA,0.0,Neutral,English
2021-05-05,TDA API FOREX?,0.0,Neutral,English
2021-05-04,Mac + Python Issues,0.0,Neutral,English
2021-05-03,How should I build my own historical data database?,0.0,Neutral,English
2021-05-01,Realtime/Delayed Implied Volatility Data Source?,0.0,Neutral,English
2021-04-21,Looking for a cooperative arrangement with a fellow algo trader,0.0,Neutral,English
2021-04-21,Experience with Decision Tree Models for algorithm trading?,0.0,Neutral,English
2021-04-18,Free API to get up to date list of all S&P 500 symbols.,0.0,Neutral,English
2021-04-15,Trading with Code,0.0,Neutral,English
2021-04-07,Binance API: How to distinguish whether a trade is a limit order or a market order ?,0.0,Neutral,English
2021-04-03,How can i get my listen Key for Binance API?,0.0,Neutral,English
2021-04-02,Can anyone recommend equties data provider?,0.0,Neutral,English
2021-04-01,Any maintained libraries for backtesting that supports multiple timeseries?,0.0,Neutral,English
2021-03-28,Best forex real-time and historical candlestick data API?,0.0,Neutral,English
2021-03-23,Questions about TDAmeritrade Options API,0.0,Neutral,English
2021-03-23,Issues with Yahoo Finance API for SPX historical data,0.0,Neutral,English
2021-03-23,Is polygon.io truly bad?,-0.6774547100067139,Negative,English
2021-03-11,Anyone know of a complete Time Series Database for trades?,0.0,Neutral,English
2021-03-08,Identifying which stocks that are the subject of a forum post,0.0,Neutral,English
2021-03-01,Real time stock quotes,0.0,Neutral,English
2021-02-27,Real time quote + trade data provider,-0.7524617910385132,Negative,English
2021-02-27,Does Polygon.io have historical intraday bid/ask spread and volume data? Which plan do I need?,0.0,Neutral,English
2021-02-25,IB market data wrong split adjustments?,0.0,Neutral,English
2021-02-24,"So, Polygon indeed has shitty data",0.0,Neutral,English
2021-02-24,Would it be helpful to you if I post the 6 ARK ETF's significant changes within each portfolio daily?,0.0,Neutral,English
2021-02-23,Is there anywhere I could find documentation for Quantopian Zipline? Zipline.io went offline this morning.,0.0,Neutral,English
2021-02-22,API discussion need advice.,0.0,Neutral,English
2021-02-22,Newsletter algorithm for aging mother?,0.0,Neutral,English
2021-02-21,[Resource] Marana: Tools for Data Analysis and Algo-Trading in C#,0.0,Neutral,English
2021-02-21,Wow. Polygon is shockingly bad.,0.0,Neutral,English
2021-02-20,Is Polygon Selling Data Illegally?,0.0,Neutral,English
2021-02-19,Replacement for Polygon.io Data feed,0.6153557896614075,Positive,English
2021-02-18,"How Redditors Find the Next GameStop Stock. On the surface, WallStreetBets looks like a casino, but an analysis of the stocks that take off reveals some common factors that drive the winners",0.0,Neutral,English
2021-02-18,DEMO: Single script trading bot using Robinstocks API,0.0,Neutral,English
2021-02-18,Polygon.io Unlimited API Calls 200/month?,0.0,Neutral,English
2021-02-15,"An awesome list about crypto trading bots : find open source crypto trading bots, technical analysis and market data libraries, data providers, APIs, ...",0.0,Neutral,English
2021-02-14,Which API would you suggest for pulling news?,0.0,Neutral,English
2021-11-17,[Dataset Release] - I created an Auto-Updating Kaggle dataset that collects high-frequency crypto market data - Updates daily! | +20 Related Trading Notebooks,0.0,Neutral,English
2021-05-31,Speeding Up the Fitting of SVI Volatility Surface Python,0.0,Neutral,English
2021-05-13,Best Tech Stock Database for Python?,0.0,Neutral,English
2021-02-02,Anyone Working on Cryptocurrency-Related Quant Projects?,0.0,Neutral,English
