Date,Title,Score,Sentiment,Language
2024-08-14,Dad asks for help about a pennystock,0.0,Neutral,English
2024-08-13,Bringin' Back BioTech - 3 Stocks to Watch This Week,0.0,Neutral,English
2024-08-12,OS Therapies moved 33% after news dropped that their Interview would air on the Big Money show on Bloomberg TV,0.0,Neutral,English
2024-08-09,ABVE - Above Food Announces Strategic Acquisition of The Redwood Group LLC's Specialty Crop Food Ingredients Division Representing Significant U.S. Expansion,0.9198333621025085,Positive,English
2024-08-09,Breaking Down 3 Names in BioTech for your Friday Watchlist,0.0,Neutral,English
2024-08-08,"RenovoRx Announces Publication of Positive Early-Stage Clinical Data in International Peer-Reviewed Journal, The Oncologist® (NASDAQ: RNXT)",0.5068358182907104,Positive,English
2024-08-08,"GSAT- Apple's LEO Network of choice, trading under $1.20 this morning after positive reports",0.0,Neutral,English
2024-08-06,LiveOne is the latest entertainment company stock to watch,0.0,Neutral,English
2024-08-06,Did you buy or sell on Monday? I added these two stocks to my watchlist for once the printer is turned on ,0.0,Neutral,English
2024-08-01,Penny Stocks that might help you escape the matrix ,0.7438461780548096,Positive,English
2024-12-31,Judge my holdings,0.0,Neutral,English
2024-12-29,What do you think the main event is in terms of AI sector in 2025? Probably the software part prevails...,-0.9404726624488831,Negative,English
2024-12-27,We are blood red,0.0,Neutral,English
2024-12-26,18yo just started stocks recently besides some stupid options plays,0.0,Neutral,English
2024-12-26,New Investor Give me tips (18 yrs),0.0,Neutral,English
2024-12-26,Need some help. What do you guys think about AMD long term? ,0.0,Neutral,English
2024-12-26,Which of these Stocks would You totally avoid? ,0.0,Neutral,English
2024-12-25,"I’ve been told a market crash is incoming/will happen and to sell, What should I do with my portfolio?",0.0,Neutral,English
2024-12-24,Potential AI stock? I would love to spot the next NVIDIA 🎄🧑‍🎄,0.9331604838371277,Positive,English
2024-12-23,Can someone please tell me which stock app this is?,0.0,Neutral,English
2024-12-20,The current stock market ,0.0,Neutral,English
2024-12-19,Remember..,0.0,Neutral,German
2024-12-18,Thanks for nothing Jerome. ,0.0,Neutral,English
2024-12-18,Roth IRA tips,0.0,Neutral,English
2024-12-18,Jumping head first into a penny stock,0.0,Neutral,English
2024-12-17,NVIDIA's Recent Decline and Opportunities for a New Rally,-0.9702513813972473,Negative,English
2024-12-17,Puts on AAPL,0.0,Neutral,English
2024-12-17,Sell or hold?,0.0,Neutral,English
2024-12-17,Which Quantum Stock to invest in? Avoid QUBT,0.0,Neutral,English
2024-12-15,"Fuel cell stocks: A decades-long struggle, but Bloom Energy looks poised to break through",0.0,Neutral,English
2024-12-14,"35-year-old, Blue collar landscaper. I’ve been investing what I can since 18. Here's my current portfolio (worth $173,000). I plan on reinvesting for the next 20-25 years. My goal is to reach $1 million or retire by 45.  I am open to any advice you may have. Thank you 💎 ",0.0,Neutral,English
2024-12-14,Is going AI-heavy a mistake?,0.0,Neutral,English
2024-12-13,AAPL taking a breather,-0.8226019144058228,Negative,English
2024-12-13,QUBT to fall further,-0.8649043440818787,Negative,English
2024-12-11,Bullish to Bearish:  What to do when the bull run ends?,0.0,Neutral,English
2024-12-10,Top three,0.0,Neutral,English
2024-12-02,Time in the market beats timing the market. Ignore the noise and let it cook. ,0.0,Neutral,English
2024-12-02,My Apple stock hit $100k,0.0,Neutral,English
2024-11-27,"These are the stocks on my watchlist (11/27)
",0.0,Neutral,English
2024-11-22,Good or bad idea to sell my top holdings and just put it into the s&p500?,0.0,Neutral,English
2024-11-18,How to Hedge Against Inflation: Thoughts on the Incoming Administration,-0.8919504880905151,Negative,English
2024-11-15,S&P 500 on Friday Nov 15,0.0,Neutral,English
2024-11-10,Last week's high volume stocks,0.0,Neutral,English
2024-11-10,When is a person too tech heavy?,0.0,Neutral,English
2024-11-06,+$1000 in My Portfolio Thanks to TSLA's 12% Jump – Other Sectors Hit Hard,0.6744976043701172,Positive,English
2024-11-01,Apple stock compounding ,0.0,Neutral,English
2024-11-01,These are the stocks on my watchlist (11/1)  ,0.0,Neutral,English
2024-10-31,These are the stocks on my watchlist (10/31),0.0,Neutral,English
2024-10-29,"19m are these picks smart, can invest about 500 more. Send some tips",0.0,Neutral,English
2024-10-29,What would be the best option here?,0.0,Neutral,English
2024-10-28,At what point should I start mitigating risk with bonds/other stable investments?,0.0,Neutral,English
2024-10-28,"17 years old, suggestions?",0.0,Neutral,English
2024-10-27,Roth IRA - Kids age 15,0.0,Neutral,English
2024-10-27,Advice on buying the dip…,0.0,Neutral,English
2024-10-23,The Nasdaq 100 lndex fell by more than 2 per cent ,-0.9734417796134949,Negative,English
2024-10-21,These are the stocks on my watchlist (10/21),0.0,Neutral,English
2024-10-18,These are the stocks on my watchlist (10/18),0.0,Neutral,English
2024-10-16,I just just started investing and need advice,0.0,Neutral,English
2024-10-14,23M Suggestions on what else I should invest,0.0,Neutral,English
2024-10-08,I switched from Schwab brokerage to Fidelity brokerage today . . . ,0.0,Neutral,English
2024-10-05,Is Palantir the Next Big Tech Stock or Overvalued Hype?,0.9486672282218933,Positive,English
2024-10-03,Been investing since I was 18 advice to tweak my portfolio first three pictures are my brokerage account last 2 are my Roth IRA,0.0,Neutral,English
2024-10-01,These are the stocks on my watchlist (10/1),0.0,Neutral,English
2024-09-19,What a day,0.0,Neutral,Somali
2024-09-18,Who came into the market,0.0,Neutral,English
2024-09-17,These are the stocks on my watchlist (9/17),0.0,Neutral,English
2024-09-16,These are the stocks on my watchlist (9/16),0.0,Neutral,English
2024-09-10,These are the stocks on my watchlist (9/10),0.0,Neutral,English
2024-09-09,New To The Stock Market,0.0,Neutral,English
2024-09-09,Apple Unveils iPhone 16 Pro: A New Chapter in Mobile Technology,0.9085479974746704,Positive,English
2024-09-09,"Apple iPhone 16 event shows off AI muscle, new Watches and AirPods",0.0,Neutral,English
2024-09-09,"Here’s everything Apple just announced: iPhone 16, iPhone 16 Pro, Apple Watch Series 10, AirPods 4 and more",0.0,Neutral,English
2024-09-09,Huawei's tri-fold phone gets 2.7 million pre-orders ahead of Apple's iPhone 16 launch,0.6466442346572876,Positive,English
2024-09-03,Been rough here any advice for a 22 M,0.0,Neutral,English
2024-09-02,Any helpful advice?,0.0,Neutral,English
2024-08-28,Nvidia announces $50 billion stock buyback,0.0,Neutral,English
2024-08-28,Simple Breakdown of the Behemoth that is NVIDIA,0.0,Neutral,English
2024-08-23,"Apple to Let iPhone Users Delete App Store, Other Native Apps to Comply With EU Law",0.0,Neutral,English
2024-08-22,What is happening right now with the market ,0.0,Neutral,English
2024-08-20,investment ,0.0,Neutral,English
2024-08-19,Portfolio review and suggestions ,0.0,Neutral,English
2024-08-16,Need some help diversifying,0.0,Neutral,Afrikaans
2024-08-15,Just started Investing Today,0.0,Neutral,English
2024-08-14,The Chips Act's Biggest Beneficiary may be...Intel!,0.0,Neutral,English
2024-08-11,I just started doing some stock trading about 3 weeks ago. How am I doing? Any advice? I bought PLTR when it was at $23,0.0,Neutral,English
2024-08-10,This downturn gonna mess me up huh?,0.0,Neutral,English
2024-08-09,TSMC Sales Surge 45% In July On Strong AI Demand ,0.956458330154419,Positive,English
2024-08-08,Help me out here yall,0.0,Neutral,English
2024-08-07,18 y/o who recently got into investing looking for any tips or suggestions. ,0.0,Neutral,English
2024-08-05,No one is safe,0.0,Neutral,English
2024-08-05,Schwab needs to shut down. ,-0.6212571859359741,Negative,English
2024-08-05,It's a bloodbath,-0.7773874998092651,Negative,English
2024-08-05,FEAR INDEX ATH INCOMING,0.0,Neutral,German
2024-08-04,Apple Intelligence Has a Long Way to Go to Match Its Marketing Hype ,0.0,Neutral,English
2024-08-03,Asking Buffett why in 2016 vs 2024,0.0,Neutral,English
2024-08-03,Nvidia: Tech stocks take a pounding as hedge fund Elliott warns AI is in ‘bubble land’,-0.8804325461387634,Negative,English
2024-08-02,Buy dip?,0.0,Neutral,English
2024-08-02,Most shorted stock,0.0,Neutral,English
2024-08-02,These are the stocks on my watchlist (8/2),0.0,Neutral,English
2024-08-01,I’ve got 9k in stocks and 1k in retirement at 16. Is that good?,0.0,Neutral,English
2024-08-01,AMZN Earnings Preview- What to watch for tonight,0.6365317106246948,Positive,English
2024-08-01,Analyzing the Analysts: Using average analyst price target to identify possible buying opportunities amongst the top 100 companies in the S&P,0.0,Neutral,English
2024-08-01,These are the stocks on my watchlist (8/1),0.0,Neutral,English
2024-07-30,20 y/o asking for portfolio review,0.0,Neutral,English
2024-07-30,Mega-caps vs. small caps,-0.8998770713806152,Negative,English
2024-07-29,"I feel like I’ve made a mistake with my investment, advice?",0.0,Neutral,English
2024-07-29,25 year old dad looking to make a future. Any advice?,0.0,Neutral,English
2024-07-26,Portfolio 53F,0.0,Neutral,English
2024-07-24,These are the stocks on my watchlist (7/24),0.0,Neutral,English
2024-07-22,These are the stocks on my watchlist (7/22),0.0,Neutral,English
2024-07-19,Learning the stock market ,0.0,Neutral,English
2024-07-16,These are the stocks on my watchlist (7/16),0.0,Neutral,English
2024-07-13,How should I get back in? ,0.0,Neutral,English
2024-07-13,Is this a good investing idea for an 18 year old,0.0,Neutral,English
2024-07-13,Markets are broadening ,0.0,Neutral,English
2024-07-12,I have $10k borrowed should I just invest it all in?,0.0,Neutral,English
2024-07-12,ARKG & ARKK,0.0,Neutral,English
2024-07-10,Nike is a bargain right now ,0.0,Neutral,English
2024-07-10,These are the stocks on my watchlist (7/10) ,0.0,Neutral,English
2024-07-09,Stocks on my watchlist for Wednesday,0.9462994933128357,Positive,English
2024-07-09,These are the stocks on my watchlist (7/9) ,0.0,Neutral,English
2024-07-08,Advice on my Stock portfolio,0.0,Neutral,English
2024-07-08,These are the stocks on my watchlist (7/8),0.0,Neutral,English
2024-06-30,Nvidia  More Room to Run: Just Getting Started,0.0,Neutral,English
2024-06-29,$AAPL's AI Play: Following a Familiar Pattern to Success?,0.0,Neutral,English
2024-06-26,Amazon Hits $2 Trillion Market Value For First Time as AI Frenzy Fuels Rally,0.8662480711936951,Positive,English
2024-06-20,Recommendations on how to get texts / messages on phone about stock movement,0.0,Neutral,English
2024-06-19,Tech Sector's Strength Offsets Weakness in Majority of S&P 500 Sectors,0.9365801811218262,Positive,English
2024-06-18,HPE: Undervalued Tech Giant on the Rise!,0.9385804533958435,Positive,English
2024-06-18,These are the stocks on my watchlist (6/18) ,0.0,Neutral,English
2024-06-17,Nasdaq Index: A Bubble About to Burst,0.0,Neutral,English
2024-06-17,A massive glitch on EU trading platform XTB caused significant financial losses for users.,-0.9734583497047424,Negative,English
2024-06-15,Tech Led the S&P 500 Higher Even as 10 of 11 Sectors Declined (2024-06-14),-0.80919349193573,Negative,English
2024-06-13,These are the stocks on my watchlist (6/13),0.0,Neutral,English
2024-06-13,VOO and chill but can you really not make smart moves?,0.0,Neutral,English
2024-06-11,These are the stocks on my watchlist (6/11) ,0.0,Neutral,English
2024-06-11,Elon Musk Threatens Apple Device Ban Over OpenAI in iOS,-0.8718305826187134,Negative,English
2024-06-10,Which company should I replace for a company like Amazon,0.0,Neutral,English
2024-06-09,Couple 3 baggers and a 5 bagger. Slow and steady wins the race,0.0,Neutral,English
2024-06-08,The sad reality,-0.6298579573631287,Negative,English
2024-06-07,S&P 500 Reaches Record High: Nvidia - The Rocket 1 Replacing Magnificent 7 (2024-06-07),0.0,Neutral,English
2024-06-06,Sing of a coming bear market?,0.0,Neutral,English
2024-06-05,"Nvidia Officially Passes Apple in Market Cap, Microsoft is Next (Just 4.43% Away)",0.0,Neutral,English
2024-06-04,Black Berry High Value,0.0,Neutral,English
2024-06-02,"Top 10 S&P 500 Companies' Market Cap Exceeds the Combined GDP of Germany, Japan, India, and the UK",0.8577058911323547,Positive,English
2024-05-30,The Growth of Top Tech Stocks ( 5-yr period),0.0,Neutral,English
2024-05-29,Seeking Pro Tips on Interpreting 10-Qs (it sucks),0.0,Neutral,English
2024-12-30,Healthtech stocks I should keep an eye on,0.0,Neutral,English
2024-12-30,"Robinhood rugpulled me, what do I do?",0.0,Neutral,English
2024-12-28,Initial Investment Advice ,0.0,Neutral,English
2024-12-28,The New Normal in Asset Valuation,0.0,Neutral,English
2024-12-27,"hello. my current portfolio is pretty diversed. i have 80% in sp500 and a international etf. now i want to have something good for my other 20%. im currently thinking of ishares sp500 information technology sector, so i have a lot of concentration on tech, and a nasdaq 100 etf. what do u guys think?",0.0,Neutral,English
2024-12-25,fidelity vs schwab vs vanguard for daily trading,0.0,Neutral,English
2024-12-21,529 plan vs brokerage account?,0.0,Neutral,English
2024-12-21,Is there a point in investing in emerging markets?,0.0,Neutral,English
2024-12-20,"13 years of investing, wondering how my book stacks up.",0.0,Neutral,English
2024-12-17,The big boys getting bigger?,0.0,Neutral,English
2024-12-17,Rate my portfolio - turnover advice,-0.5813794136047363,Negative,English
2024-12-16,"Putting $7,500 into VFV at 19 years old a good idea? ",0.0,Neutral,English
2024-12-16,2.5 year follow-up on buying the dip on pandemic stocks,0.0,Neutral,English
2024-12-15,Investing in publicly-traded assets to benefit from AI automation,0.0,Neutral,English
2024-12-13," Investing in construction CAT, URI, and NUE",0.5107496380805969,Positive,English
2024-12-12,Duplicated ACAT transfer question.,0.0,Neutral,English
2024-12-10,Looking for advice small caps tech etf,0.0,Neutral,English
2024-12-08,What's a Reliable Source for Risk-Adjusted Returns?,0.0,Neutral,English
2024-12-08,Portfolio allocation talk,0.0,Neutral,English
2024-12-06,"COVID as a Mini ""Lost Decade""",0.0,Neutral,English
2024-12-06,Roth vs Trad Vanguard / Confirmation,0.0,Neutral,English
2024-12-06,Keep AAPL or pay federal student loans?,0.0,Neutral,English
2024-12-05,What is your thought on my portfolio and strategy?,0.0,Neutral,English
2024-12-04,Does this time remind you of the dot-com era?,0.0,Neutral,English
2024-12-04,17 year old looking for some long term investment ideas,0.0,Neutral,English
2024-12-04,"Need Help! I just opened a taxable brokerage with Schwab, here’s my plan. This is a 15-20 year plan. Thoughts?",0.0,Neutral,English
2024-12-03,Investment Advice- Rebalancing?,0.0,Neutral,English
2024-11-29,Old IRA very overweight in two equities - opinions please.,0.0,Neutral,English
2024-11-26,My investment portfolio hits 75% paper gain. Time to sell everything and run? ,0.7568075060844421,Positive,English
2024-11-20,My mother asked me if I can help her with investing,0.0,Neutral,English
2024-11-19,Margin Loans to Grow Your Portfolio: To Do or Not To Do! ,0.0,Neutral,English
2024-11-15,Question Nasdaq s&p eft’s,0.0,Neutral,English
2024-11-13,"How many of your actually beat the market, and what's your methodology?",0.0,Neutral,English
2024-11-09,Just saw a post about Motley Fool,0.0,Neutral,English
2024-11-07,"What's the take on AAPL's future given Trump victory, Tariffs and Elon gaining more power",0.0,Neutral,English
2024-11-06,Can I do my own trading with a rollover IRA?,0.0,Neutral,English
2024-11-03,does anyone know a good resource to get the earnings calendar for the past and next week?,0.0,Neutral,English
2024-11-03,The Contradiction of Warren Buffet's Avoidance of $TSLA,0.0,Neutral,English
2024-11-02,What’s the best app to use,0.0,Neutral,English
2024-11-02,Brk’s latest portfolio change,-0.9555468559265137,Negative,English
2024-11-02,Something specific to watch out for when investing in EnergyX,0.0,Neutral,English
2024-10-31,Brokerage refusing to update my cost basis after it was received,0.0,Neutral,English
2024-10-29,What do FAANG companies offer in terms of retirement matching?,0.0,Neutral,English
2024-10-27,Open a second account? Not sure If there is a benefit ,0.0,Neutral,English
2024-10-27,How do I choose investment ratio between individual shares?,0.0,Neutral,English
2024-10-23,Best place to put $750k from selling an investment property. I am 52,0.0,Neutral,English
2024-10-23,Portfolio breakdown and advice….,0.0,Neutral,English
2024-10-23,Balancing an all-equity portfolio,0.0,Neutral,English
2024-10-18,My Personal Guide to Good Financial Health for People in their 20s/30s,0.0,Neutral,English
2024-10-18,More and more highly capitalized stocks are reaching their ATH or yearly highs every day or every week... Are you selling those positions? Are you waiting for the momentum to slow down before shorting? Will you buy the dip when these stocks drop by -10% or -20%...?,0.0,Neutral,English
2024-10-18,Is having a  Financial Advisor help your portfolio?,0.0,Neutral,English
2024-10-17,Alphabet (GOOG) or Amazon (AMZN),0.0,Neutral,English
2024-10-15,"""frontier tech"" portfolio ",0.0,Neutral,English
2024-10-14,Am I crazy by investing every penny of mine in real estate and bitcoin?,0.0,Neutral,English
2024-10-12,Asset allocation 65% Bonds,-0.8208045959472656,Negative,English
2024-10-09,TSMC Earnings Ahead: Could this cause NVDA to reach new highs?,0.9276543855667114,Positive,English
2024-10-09,Not even sure what to do about my account,0.0,Neutral,English
2024-10-09,Forex Macro Strategy Advice,0.0,Neutral,English
2024-10-07,Brokerage with hardware based two factor authentication ,0.0,Neutral,English
2024-10-05,Hedge with inverse leveraged ETF or buy puts?,0.0,Neutral,English
2024-10-04,Is anyone else investing with Roots or have you invested in the past?,0.0,Neutral,English
2024-10-02,Any good apps to track portfolio diversity across multiple accounts? ,0.0,Neutral,English
2024-09-29,Assessing an investment opportunity ,0.0,Neutral,English
2024-09-28,Discussion on Apple being part of x ETFs worldwide,0.0,Neutral,English
2024-09-27,How do I diversify my investments?,0.0,Neutral,English
2024-09-26,Need Help to figure out what to do with the free AAPL stock,0.0,Neutral,English
2024-09-25,Top Growth stocks with 2x leveraged etfs!!!,0.0,Neutral,English
2024-09-23,Godfather Opened an Account in my Name (and his?),0.0,Neutral,English
2024-09-22,Can I roll over my old Thrivent roth ira into my new Fidelity Roth? Or keep both. ,0.0,Neutral,English
2024-09-20,"Brain Organoids, meat in the computer instead of silicone chips?",0.0,Neutral,English
2024-09-20,"Just sold my entire AAPL position! After what looks like a double or even triple top, it felt like the right moment to exit.",0.0,Neutral,English
2024-09-20,Portfolio Review of a Teenage Investor; how am I looking?,0.0,Neutral,English
2024-09-19,API for historical TTM EPS,0.0,Neutral,English
2024-09-18,What ETF/Stock should I have?,0.0,Neutral,English
2024-09-17,"Even if you are extremely unlucky, you will be still ahead in 10 years",0.0,Neutral,English
2024-09-05,How the F do you calculate margin?,0.0,Neutral,English
2024-09-03,Any tax reducing strategies to diversify single stock concentration?,0.0,Neutral,English
2024-08-30,Is the Silo bond investing app legit?,0.0,Neutral,English
2024-08-30,Nvidia’s massive stock buyback,0.8505614399909973,Positive,English
2024-08-28,How do you do a proper research on a company?,0.0,Neutral,English
2024-08-28,brk is 30% of apple stock.. now apple PE is 34 and BRK’s PE is 14.5 What does this mean? Does it mean I am paying 34+14.5 times the earnings for Apple stock? ,0.0,Neutral,English
2024-08-26,Which Biotechs do you think will be winners?,0.5270127058029175,Positive,English
2024-08-24,Auto Invest Accounts vs other trading accounts,0.0,Neutral,English
2024-08-23,Better choice for tech sector ETF ,0.0,Neutral,English
2024-08-22,Anyone use a folding phone to trade? ,0.0,Neutral,English
2024-08-21,Next Steps with Rebalance and Growth,0.0,Neutral,English
2024-08-21,Should I go more into ETFs or individual stocks ,0.0,Neutral,English
2024-08-19,Investing in military stock?,0.0,Neutral,English
2024-08-17,Investing in India as a next growth powerhouse? ,0.0,Neutral,English
2024-08-17,Opportunities in Carbon Capture Technology,0.5933824181556702,Positive,English
2024-08-14,IBM: why is no one talking about them,0.0,Neutral,English
2024-08-13,Is there an Apple settlement? I received an email but I’m afraid to click on the attachments,0.0,Neutral,English
2024-08-12,Investing is turning stressful,0.0,Neutral,English
2024-08-06,3 Fund Portfolio / Bond Advice,0.0,Neutral,English
2024-08-06,What should Apple do to replace the money they get from Google?,0.0,Neutral,English
2024-08-06,Do you think Buffet diworsified by selling Apple stock? Why or why not? ,-0.7296640872955322,Negative,English
2024-08-05,Cannot log into Schwab account this morning,0.0,Neutral,English
2024-08-03,What were legal ways to estimate beforehand that iPhone sales in China had slowed?,-0.9257341027259827,Negative,English
2024-08-03,recommendations for growth investments,0.0,Neutral,English
2024-08-02,Help is needed: sell or rent it out?,0.0,Neutral,English
2024-08-02,"With the large tech sell-off, what tech stocks are you hoping into?",0.0,Neutral,English
2024-08-02,Why is the close price on wallstreet.io different from what I see on Tradingview?,0.0,Neutral,English
2024-08-01,Analyzing the Analysts: Using average analyst price target to identify possible buying opportunities amongst the top 100 companies in the S&P,0.0,Neutral,English
2024-07-24,Why is Microsoft stock Falling ,-0.8124806880950928,Negative,English
2024-07-23,Question for those using Investing.com for tracking stocks…,0.0,Neutral,English
2024-07-17,Would an All In Fund that only ever held the single largest stock have beaten global indices?,0.0,Neutral,English
2024-07-17,Why are Tech Stocks Falling? ,-0.9328467845916748,Negative,English
2024-07-16,Choosing Between XLK and VGT for Information Technology Sector Exposure,0.0,Neutral,English
2024-07-15,How should I be thinking about investing for the first time at 40 years old?,0.0,Neutral,English
2024-07-15,Active IRA management vs index funds and ETFs?,0.0,Neutral,English
2024-07-13,UNH Stock - Earnings Due Diligence for upcoming earnings ,-0.8093030452728271,Negative,English
2024-07-13,"$91k in HYSA, is it wasting away?",0.0,Neutral,English
2024-07-10,How far do you think we are in the AI stock market hype cycle?,0.0,Neutral,English
2024-07-10,"Is the S&P 500 becoming irrelevant for investors looks for overall equity exposure, and becoming more of a sector play on tech?",0.7187860608100891,Positive,English
2024-07-09,Investment versus rent-what would you do ? ,0.0,Neutral,English
2024-07-08,"Solid increase in value for one of the securities in my portfolio, What Would Reddit Do? ",0.5869548320770264,Positive,English
2024-07-08,Interested in thoughts on five to ten year retirement plan,0.0,Neutral,English
2024-07-07,Buy Hold Sell: 2 high conviction tech stocks for the next 12 months,0.8906285166740417,Positive,English
2024-07-07,Is it smart to have both a regular 401k and a Roth IRA?,0.0,Neutral,English
2024-07-04,Current analyst ratings of the 10 biggest US stocks,0.0,Neutral,English
2024-07-03,Anyone else seeing these daily ~5% aftermarket flash drops in Big Tech? Insider or whale selloff?,-0.5343031883239746,Negative,English
2024-06-29,Finviz: how to control what the Stock Detail link displays?,0.0,Neutral,English
2024-06-28,S&P 500 Tech ETF vs Nasdaq ETF vs Others,0.0,Neutral,English
2024-06-27,Investing: how to completely diversify ,0.0,Neutral,English
2024-06-26,Safe starting plan to get into Futures? As well as what to do with my ROTH? ,0.0,Neutral,English
2024-06-26,What are your thoughts on VIGAX? ,0.8423238396644592,Positive,English
2024-06-25,Investing in EFTs without tech,0.0,Neutral,English
2024-06-25,Preferred Industries and Sectors,0.0,Neutral,English
2024-06-24,"Hey All: Need some advice about Edward Jones
",0.0,Neutral,English
2024-06-24,Understanding the Impact of Interest Rate Hikes on Tech Stocks,-0.6410346627235413,Negative,English
2024-06-24,Market questions and advice ,0.0,Neutral,English
2024-06-23,Where Are Analysts Most Optimistic on Ratings for S&P 500 Companies Heading Into Q3?,0.0,Neutral,English
2024-06-22,Options Charting Libraries?,0.0,Neutral,English
2024-06-21,Cheapest sources of risk for the leverage-constrained?,0.0,Neutral,English
2024-06-20,Large position in mega-cap tech stock almost 100% long term capital gains,-0.9225038290023804,Negative,English
2024-06-17,"Nvidia to get 20% weighting and billions in investor demand, while Apple demoted in major tech fund",-0.8910722732543945,Negative,English
2024-06-17,"'Big Short' Investor Steve Eisman, Who Predicted '08 Market Crash, Says To Hold On To Apple Stocks",0.0,Neutral,English
2024-06-14,Thoughts on Apple AI launch? ,0.0,Neutral,English
2024-06-14,Solar is a great investment. Trivial 10% returns; 30% returns possible.,0.0,Neutral,English
2024-06-13,Is AMD actually a stock to hold for 10-20 years?,0.0,Neutral,English
2024-06-13,Is DigitalOcean majorly undervalued?,0.0,Neutral,English
2024-06-11,Favorite tading platform?,0.0,Neutral,English
2024-06-10,Fiverr - An unfairly beaten down 'pandemic stock'? An Investment Thesis for what currently looks like a contrarian bet. ,0.0,Neutral,English
2024-06-10,AAPL took dip after WWDC. ,0.0,Neutral,English
2024-06-08,Best counter-balance to tech stocks?,0.0,Neutral,English
