Date,Title,Score,Sentiment,Language
2021-04-04,Reprogramming Old Cells Young Again | Lifespan.io,0.0,Neutral,English
2021-04-01,Advances in Telemedicine IoT Devices / What’s New in Telemedicine IoT World?,0.0,Neutral,English
2021-03-30,Silicon Valley leaders think A.I. will one day fund free cash handouts. But experts aren’t convinced,0.0,Neutral,English
2021-03-28,"Elon Musk - ""It’s not really possible to match the human brain in 2021 for any amount of money imo, but it will be possible probably in a few years""",0.0,Neutral,English
2021-03-28,"Backed by Japan coffee giant and Taiwan big tech, Hiroia wants to orchestrating hundreds of coffee brewers with IoT technology",0.0,Neutral,English
2021-03-27,"5G as a wireless power grid: Unknowingly, the architects of 5G have created a wireless power grid capable of powering devices at ranges far exceeding the capabilities of any existing technologies. Researchers propose a solution using Rotman lens that could power IoT devices.",0.0,Neutral,English
2021-03-24,Quantum Dot Nanomedicine for Longevity Drugs | Lifespan.io,0.0,Neutral,English
2021-03-17,"""Powers of 10"" universe simulation VR/iOS app is a magic carpet ride into the infinite...",0.0,Neutral,English
2021-03-10,"Apple To Build a ""Mini Silicon Valley"" in Germany With 1 Billion Euro Investment",0.0,Neutral,English
2021-03-05,"Hey! My friend and I are engineers who have a curiosity about the future of technology and how Industry 4.0 plays a huge role in that. We want to discuss the latest news in I4.0, some of our personal projects around 3D printing and IoT, as well as professional resources. We would love your feedback!",0.0,Neutral,English
2021-02-28,Internet of Cars: A driver-side primer on IoT implementation,0.0,Neutral,English
2021-02-27,"Tangibly speaking, what is your personal opinion on how close we are to LEV(Longevity Escape Velocity)?",0.0,Neutral,English
2021-02-22,The NIA Is Funding Clinical Trials Against Aging | Lifespan.io,0.0,Neutral,English
2021-02-21,Technology Readiness Levels,0.0,Neutral,English
2021-02-19,The NIA opens a grant program for early-stage human trials targeting aging itself | Lifespan.io,0.0,Neutral,English
2021-02-18,The NIA Is Funding Clinical Trials Against Aging | Lifespan.io,0.0,Neutral,English
2021-02-16,"Nevada’s Sales Pitch to Silicon Valley: You Can Create Your Own Government Here - A bill in the works would turn over large tracts of Nevada to tech companies, allowing them to build—and run—their own towns.",0.0,Neutral,English
2021-01-21,Apple's first-ever headset will reportedly be a pricey device that paves the way for an eventual iPhone replacement,0.49552372097969055,Positive,English
2021-01-18,How Miami Mayor Francis Suarez is luring tech players from Silicon Valley and New York,0.0,Neutral,English
2021-01-13,Image Reconstruction from brain Activity,0.0,Neutral,English
2021-01-06,Tesla autonomously navigates from Los Angeles to Silicon Valley with zero interventions,0.0,Neutral,English
2021-01-06,Charge your iPhone via Mac & iPad: Is this what Apple’s wireless future looks like?,0.0,Neutral,English
2021-12-18,Needless Terror From Glitching Balance Calculations (anyone else experience this?),0.0,Neutral,English
2021-11-23,Locked out fraud investigation,0.0,Neutral,English
2021-10-19,Cant find TD ameritrade or TOS mobile app on google play (android),0.0,Neutral,English
2021-10-17,Can’t log in?,0.0,Neutral,English
2021-10-15,Does the TDAmeritrade app have trouble running on iOS 15?,-0.664178192615509,Negative,English
2021-10-09,Strange double login request,0.0,Neutral,English
2021-10-08,API - TRAILING_STOP_LIMIT not possible?,0.0,Neutral,English
2021-09-23,Overnight Cost Per Share Discrepancy,-0.8684735894203186,Negative,English
2021-09-15,Quick question about keeping my account active.,0.0,Neutral,English
2021-09-14,TD Ameritrade has blocked me from buying since I tried making a deposit for 100k last tuesday.,-0.8168696165084839,Negative,English
2021-08-24,How can I simultaneously buy back a covered call and sell the shares?,0.0,Neutral,English
2021-08-01,Very confused,-0.9530256390571594,Negative,English
2021-07-24,"TD API's Get Option Chain not working for all the strategies ( BUTTERFLY, CONDOR, DIAGONAL )",0.0,Neutral,English
2021-07-05,TDA Singapore: months to open an account!?,0.0,Neutral,English
2021-07-04,Don't see TD Mobile App in Google Play,0.0,Neutral,English
2021-07-02,I'm having trouble with conditional orders... anyone else? Am I doing something wrong?,-0.5470102429389954,Negative,English
2021-07-02,"Transferring an options contract from Robinhood to TD Ameritrade. What do I put as Robinhood’s “firm name,” physical address, and phone number?",0.0,Neutral,English
2021-06-28,Slow and inconsistent alerts in Android TD Ameritrade mobile app?,-0.5992687940597534,Negative,English
2021-06-25,Apple vs. ETF,0.0,Neutral,English
2021-06-23,Dark mode for IOS app!!,0.0,Neutral,English
2021-06-18,Order fill email notification?,0.0,Neutral,English
2021-06-15,Login Bugged?,0.0,Neutral,English
2021-06-11,What’s going on TD Ameritrade?,0.0,Neutral,English
2021-06-09,Cost price went up?,0.0,Neutral,English
2021-06-07,Wouln't let me nor my customer represetative cover my short,0.0,Neutral,English
2021-05-30,Being assigned in ROTH IRA. Questions regarding the technicalities and lack of funds to cover the position,0.0,Neutral,English
2021-05-26,TDA API - how to get option quote using 'Get Quote' API endpoint?,0.0,Neutral,English
2021-05-05,How do I withdraw?,0.0,Neutral,English
2021-05-04,Invalid Control Number for GME,0.0,Neutral,English
2021-05-03,Tax questions?,0.0,Neutral,English
2021-05-02,Why does it show no funds available for withdrawal even though I have $5000?,0.0,Neutral,English
2021-04-30,Ameritrade lost my account?,0.0,Neutral,English
2021-04-28,Application Process for Tier 3 Options,0.0,Neutral,English
2021-04-25,Account restricted,-0.5133922100067139,Negative,English
2021-04-23,Looking for an alternative that will let me write calls on restricted securities covered by shares I already own via the web?,0.0,Neutral,English
2021-04-17,Uhg. Help,0.0,Neutral,English
2021-04-15,Max Limit Sell,0.0,Neutral,English
2021-04-15,Question about opening an account as a Brazilian,0.0,Neutral,English
2021-04-10,How do I set a high limit sell on tda?,0.0,Neutral,English
2021-04-04,thinkorswim native M1 Mac update,0.0,Neutral,English
2021-04-02,TD saying I have -3500 shares?,0.0,Neutral,English
2021-03-29,Incorrect stock prices?,0.0,Neutral,English
2021-03-25,Anyone else’s share price different from their ask/bid?,0.0,Neutral,English
2021-03-24,TOS mobile for iOS sucking today,0.0,Neutral,English
2021-03-17,What are these guys on?,0.0,Neutral,English
2021-03-15,Unable to login,-0.5864019393920898,Negative,English
2021-03-13,Price average went up by itself,-0.7678380012512207,Negative,English
2021-03-13,I can't login to my account...,-0.5497298836708069,Negative,English
2021-03-10,I never thought AAPL would be my anchor.,0.0,Neutral,English
2021-03-05,I was victim to identity theft and I need advice,-0.688916027545929,Negative,English
2021-03-04,ACH Failed - Funds belong to TD?,0.0,Neutral,English
2021-03-03,Charts Bug?,0.0,Neutral,English
2021-03-01,Don't exercise options?,0.0,Neutral,English
2021-03-01,Is there a way to contact TDA by email regarding a new account opening process?,0.0,Neutral,English
2021-02-28,Assistance with Contingent Orders for GME,0.0,Neutral,English
2021-02-28,Password reset?,0.0,Neutral,English
2021-02-27,"1hr+ hold times, frozen account - Taking my business elsewhere",-0.7436469197273254,Negative,English
2021-02-27,Can't reach Ameritrade customer service,0.0,Neutral,English
2021-02-26,Sink or swim mobile app,0.0,Neutral,English
2021-02-26,I need legal counsel.,-0.9571574330329895,Negative,English
2021-02-25,Login failure?,-0.6876701712608337,Negative,English
2021-02-22,Advice On What To Do Now,-0.921217679977417,Negative,English
2021-02-19,Phantom Share Update 2 - Option Glitch Week 2,-0.8007105588912964,Negative,English
2021-02-17,TD AMERITRADE PHANTOM SHARES,-0.8275799751281738,Negative,English
2021-02-16,TD isn't fixing things...,-0.8280883431434631,Negative,English
2021-02-16,TD Ameritrade ongoing accounting issues,-0.5112618207931519,Negative,English
2021-02-16,Trying to get CNBC to report on this,-0.8716962933540344,Negative,English
2021-02-16,2.5hrs wait - finally talked to Support on wrong exercised and margin calls.,-0.5650609135627747,Negative,English
2021-02-15,So disappointed in what TD has become.,0.0,Neutral,English
2021-02-12,"New User, Didn't Know about 15 minute real-time quote delay, got fucked and lost $1800",-0.5068877339363098,Negative,English
2021-02-12,Rant about trading AMC Options,-0.8051595687866211,Negative,English
2021-02-12,Is ThinkorSwim Down this morning? (Feb 12). Logged in by no Window,0.0,Neutral,English
2021-02-11,Is anyone else having trouble accessing their account?,0.0,Neutral,English
2021-02-10,Trade restrictions liquidating trades only?,0.0,Neutral,English
2021-02-09,Need help with opening my account.. since I can't reach customer support,0.0,Neutral,English
2021-02-09,"New on TD from Robinhood, overall think it’s solid but a few major qualms....",0.0,Neutral,English
2021-02-09,I own stock in RIOT. TD won't let me sell it.,0.0,Neutral,English
2021-02-08,Dark mode,0.0,Neutral,English
2021-02-08,AMC Covered Calls Still being Restricted,-0.7500778436660767,Negative,English
2021-02-06,What is your strategy ?,0.0,Neutral,English
2021-02-05,How long does a withdrawal take and can it go wrong?,-0.6071892976760864,Negative,English
2021-02-05,Magical list of untradeable stocks,0.0,Neutral,English
2021-02-03,Day's P/L calculation on stocks traded,0.0,Neutral,English
2021-02-02,Desperate help needed to unlock my account,0.0,Neutral,English
2021-02-02,Can’t withdraw funds?,0.0,Neutral,English
2021-01-29,Can't login? When I try on a different platform it sends a security code to my phone I enter it and this happens. When I try again it brings me to my 2step verification and the answers aren't working and it just deletes the answer and doesn't tell me if I got it wrong.,0.0,Neutral,English
2021-01-29,After/pre hours vs extended hours,0.0,Neutral,English
2021-01-27,Change Phone Number,0.0,Neutral,English
2021-01-27,PLS HELP,0.0,Neutral,English
2021-01-27,TD AMERITRADE STOCK withdrawal? Need some help and info please!,0.0,Neutral,English
2021-01-27,WITHDRAWING MONEY FROM TD AMERITRADE STOCK TAXES?,0.0,Neutral,English
2021-01-27,Not Enough Buying Power?,0.0,Neutral,English
2021-01-22,Restrictions on Account,0.0,Neutral,English
2021-01-22,TD Ameritrade Customer Service Quality,-0.515412449836731,Negative,English
2021-01-12,When Will Support Come Back?,0.0,Neutral,English
2021-01-12,quick question about buying power,0.0,Neutral,English
2021-01-10,Help scanning in thinkorswim,0.0,Neutral,English
2021-01-08,Opening new TD Ameritrade account in Singapore? How long to get service support replies?,0.0,Neutral,English
2021-12-03,2FA Login Broken in Android App,0.0,Neutral,English
2021-11-01,"Doesn’t seem we can add a trailing stop to an existing position, ATP ?",0.0,Neutral,English
2021-10-25,There are additional limitations for trading violations,-0.7305119633674622,Negative,English
2021-10-22,DAE have problems with the advanced chart?,0.0,Neutral,English
2021-10-16,Fidelity Cash Promotion Secret,0.0,Neutral,English
2021-10-01,Anyone else has crash issues using iPhone ?,-0.6466126441955566,Negative,English
2021-09-27,No Charts - Tech Support,0.0,Neutral,English
2021-09-24,hacked,-0.5606831312179565,Negative,English
2021-09-24,Fidelity has uninformed people at the “trading desk”.,0.0,Neutral,English
2021-08-26,Full View,0.0,Neutral,English
2021-08-13,Partial transfer to CoumputerShare?,0.0,Neutral,English
2021-08-13,"Fidelity: ""All or nothing"" - transfer to ComputerShare",0.0,Neutral,English
2021-08-09,Hello,0.0,Neutral,English
2021-08-06,"So far I have to say that my ""customer service experience"" is a joke!",-0.6624419093132019,Negative,English
2021-08-05,Brokerage Account Problems,-0.9280983805656433,Negative,English
2021-07-23,"I keep getting redirected to this ""feature is not available"" message when searching for a stock on the iOS Netbenefits app.",0.0,Neutral,English
2021-07-16,Customer Service today at Fidelity :(,0.0,Neutral,English
2021-06-29,"revisiting the fidelity ""orders by retail customers"" page",0.0,Neutral,English
2021-06-25,"messaging with Fidelity, available on app?",-0.6105533242225647,Negative,English
2021-06-21,PDT removal,0.0,Neutral,English
2021-06-14,Beta on IOS is so much better,0.0,Neutral,English
2021-06-13,Beta on Android?,0.0,Neutral,English
2021-06-10,Fidelity just sold 2 shares of GME for me?,0.0,Neutral,English
2021-06-03,“Settled” cash gets unsettled after subsequent deposit,-0.5550287365913391,Negative,English
2021-06-01,Will Fidelity Refund Transfer Fees Multiple Times?,0.0,Neutral,English
2021-06-01,What do I do if Robinhood never sends my cost basis information?,0.0,Neutral,English
2021-05-28,Options Day Trading PDT,0.0,Neutral,English
2021-05-27,21st century customer service achievement award,0.0,Neutral,English
2021-05-25,Mobile App Beta,0.0,Neutral,English
2021-05-19,I thought meme stocks only went up? something must be broken. Whose fault is it?,-0.8829516172409058,Negative,English
2021-05-15,DAE have to launch the app twice for it to work?,0.0,Neutral,English
2021-05-10,For Mac/ATP Users,0.0,Neutral,English
2021-05-05,The level one options trading permission is an absolute joke,0.0,Neutral,English
2021-05-05,What the fidelity beta looks like on iPhone,0.0,Neutral,English
2021-05-04,Have you tried the beta experience on mobile app and do you like it?,0.0,Neutral,English
2021-04-25,How to set a limit order for premarket?,0.0,Neutral,English
2021-04-25,Performance Tab on iPad on iPhone?,0.0,Neutral,English
2021-04-23,interesting: you have to pay to short COIN now,0.0,Neutral,English
2021-04-22,Account transfer from Robinhood changed my stocks to margin.,0.0,Neutral,English
2021-04-19,Anyone else having mobile check deposit issues?,0.0,Neutral,English
2021-04-14,How is this possible and how can I fix this?,0.0,Neutral,English
2021-04-12,"interesting how a number of symbols in the fidelity ""top orders"" page are hard to short (or unavailable even)",0.0,Neutral,English
2021-04-10,"I hate the very large caps. The 25 stock portfolio I hate. Tell me why I shouldn't, please",-0.8976929783821106,Negative,English
2021-04-07,"10 large cap stocks . Using the Fidelity research pages, do you say thumbs up or thumbs down on each one?grep What info do you look at?",0.0,Neutral,English
2021-04-01,Fidelity is extorting me for personal information.,-0.7239187359809875,Negative,English
2021-04-01,Got fidelity app month ago to trade!,0.0,Neutral,English
2021-03-31,iPhone 12 new update - Fidelity app will not open,-0.6252115964889526,Negative,English
2021-03-31,Active Trader Crashing,-0.7660493850708008,Negative,English
2021-03-29,"plenty of talkin' when they're up, not so much when they're down.",0.0,Neutral,English
2021-03-28,Is there a reason Fidelity took $50 from me when i only purchased $24 worth of shares?,0.0,Neutral,English
2021-03-28,"rumor: US govt funded RH so that stim money could be used to inflate market prices, and create increased tax returns from millenials.",0.0,Neutral,English
2021-03-25,Anyone use an alternative ticker app to ATP on macOS?,0.0,Neutral,English
2021-03-23,Am I doing something wrong or does the app/widget just suck?,0.0,Neutral,English
2021-03-23,Mobile App keeps crashing,-0.49928945302963257,Negative,English
2021-03-23,Settlement dates?,0.0,Neutral,English
2021-03-22,Do I basically need to buy a PC to have a usable Active Trader Pro?,0.0,Neutral,English
2021-03-21,How best to have Fidelity Execute an ITM Call Option PRIOR to Expiration?,0.0,Neutral,English
2021-03-21,How do ex-RH users research stonks?,0.0,Neutral,English
2021-03-20,Can no longer deposit checks via iOS app,0.0,Neutral,English
2021-03-17,Possible GME restrictions coming? Fidelity goes broke? Heavy pushing in r/GME to transfer here.,0.0,Neutral,English
2021-03-15,009972 error resolution?,0.0,Neutral,English
2021-03-13,"Surely, the bubble will burst when the Fear Of Missing Out (FOMO) ETF launchs...NOT A JOKE!",0.0,Neutral,English
2021-03-12,"Hmm.. at what point will the RHers realize swaggy doesn't consistnetly = ""more money""",0.0,Neutral,English
2021-03-12,Missing AAPL stock,-0.7245089411735535,Negative,English
2021-03-11,Customer Support,0.0,Neutral,English
2021-03-08,Why is it such a nightmare to get options approved?,-0.8202994465827942,Negative,English
2021-03-04,"""day change"" under accounts isn't updating?",0.0,Neutral,English
2021-03-04,How I got transferred from Robinhood to Fidelity in 4 business days,0.0,Neutral,English
2021-03-03,Fidelity issued me a $33K Margin call for making a $50 day trade. After 2 hours with customer service they couldn't explain why the call was so high and asked me to call back tomorrow. Does anyone here have any insight?,0.0,Neutral,English
2021-02-25,Cash not settling weeks after deposits?,0.0,Neutral,English
2021-02-25,How do I make the stocks auto refresh the prices like it does on robinhood on the Fidelity app?,0.0,Neutral,English
2021-02-24,POOR customer service lately at Fidelity,-0.8287687301635742,Negative,English
2021-02-24,My shares have been sold?,0.0,Neutral,English
2021-02-23,Fidelity automatically liquidated shares to cover $150 I owed - is this normal?,0.0,Neutral,English
2021-02-23,Couple questions,0.0,Neutral,English
2021-02-22,Conditional/OCO order on fidelity iOS app,0.0,Neutral,English
2021-02-20,FYI: Fidelity now allows enabling of penny stock trading right on the website/app,0.0,Neutral,English
2021-02-18,Is anyone else getting error messages when trying to transfer money within Fidelity portfolio?,0.0,Neutral,English
2021-02-17,Fidelity ap Log In issue,-0.552119255065918,Negative,English
2021-02-16,Fidelity App,-0.8473402261734009,Negative,English
2021-02-13,Mobile Check Deposit not working for Rollover Check,0.0,Neutral,English
2021-02-12,Transferring Over IRA from T Rowe Price to Fidelity need Medallion Signature Guarantee,0.0,Neutral,English
2021-02-11,Why is my cash available to trade balance zero?,0.0,Neutral,English
2021-02-11,Penny Stocks Restriction,0.0,Neutral,English
2021-02-11,Bank is linked but not listed as a way to deposit money,0.0,Neutral,English
2021-02-11,"Deposited funds, buying power still says $0? Won't let me trade?",0.0,Neutral,English
2021-02-10,iPhone Widget,0.0,Neutral,English
2021-02-10,Margin Debit Balance after transfer from Robinhood,0.0,Neutral,English
2021-02-10,My Bank account wont link to Fidelity and I don't want to wait another 2 hours on the phone to talk to someone from customer service.,0.0,Neutral,English
2021-02-10,System Error when opening account.,-0.5335578918457031,Negative,English
2021-02-09,Dark mode,0.0,Neutral,English
2021-02-09,I can't open a new account because the app crashed on me.,0.0,Neutral,English
2021-02-09,Cash Never Settled?,0.0,Neutral,English
2021-02-09,Transfer from RH Botched - Status Completed,0.0,Neutral,English
2021-02-08,"Fidelity iOS App ""Quick Access"" Issues?",0.0,Neutral,English
2021-02-07,Live Quotes on Mobile App?,0.0,Neutral,English
2021-02-06,Fidelity mobile app UI,0.0,Neutral,English
2021-02-05,Is there a way to see after market prices reflected in watchlist/account view?,0.0,Neutral,English
2021-02-04,Been trying to open a brokerage account for 6 weeks!,0.0,Neutral,English
2021-02-03,Phone and chat support is slammed,-0.8597147464752197,Negative,English
2021-02-03,Trying to open a Brokerage Account but I already have one?,0.0,Neutral,English
2021-02-03,Limited margin training with rollover IRA,0.0,Neutral,English
2021-02-03,Trouble with transferring Robin Hood to Fidelity (including margin issue),0.0,Neutral,English
2021-02-03,Trying to register but it says I already have an account,0.0,Neutral,English
2021-02-03,"“Verification Failed” loading a potential trade (a preview), and then trade went thru despite not hitting the submit button....",-0.5811175107955933,Negative,English
2021-02-03,Real-Time Quotes Just Don't Work?,0.0,Neutral,English
2021-02-03,PSA if you have margin debit on your Fidelity that showed up while transferring from Robinhood CALL!,0.0,Neutral,English
2021-02-02,"For anyone that uses Fidelity’s option of Symantec VIP Access for two factor authentication, what are your thoughts on it?",0.0,Neutral,English
2021-02-02,Trying to recover old brokerage account,-0.5708079934120178,Negative,English
2021-02-02,Every time I try to open an account it says it can't verify my identity,-0.5456897020339966,Negative,English
2021-02-01,Macbook pro performance?,0.0,Neutral,English
2021-01-31,"On iOS app, is there any way to see percentage change on charts for 3M, 1YR, 5YR?",0.0,Neutral,English
2021-01-31,"Went to go make a Fidelity account couple minutes ago, says I have one, how? never have had an account only had RH in the past?",0.0,Neutral,English
2021-01-31,Please help...I got this error from Fidelity..I am new to investing and not having luck getting through to speak to someone on the phone after several attempts waiting hours on end each time.,0.0,Neutral,English
2021-01-31,"""Due to Market Risk concerns, your trading capabilities have been frozen""",-0.5464449524879456,Negative,English
2021-01-31,UTMA account for my teen - do they log in with my info or can they with their own?,0.0,Neutral,English
2021-01-31,FYI - Fidelity cancelled my new 1/28 account without my consent.,0.0,Neutral,English
2021-01-30,Softlocked by 2FA: put in the wrong phone number and now I'm stuck,0.0,Neutral,English
2021-01-30,how the hell do i add money to my accounts from paypal?,0.0,Neutral,English
2021-01-29,Linking Bank,0.0,Neutral,English
2021-01-29,What gives? Waiting an hour for a phone call that never got answered! I have a problem....pick up the phone!,-0.8061206936836243,Negative,English
2021-01-29,"What happened to the IOS 14 widget that showed our account balance, dow/s&p price?",0.0,Neutral,English
2021-01-29,phone number added to my fidelity account?,0.0,Neutral,English
2021-01-29,Question about NetBenefit account,0.0,Neutral,English
2021-01-29,Fidelity beginner guide with links,0.0,Neutral,English
2021-01-28,Fidelity not letting me place any limit sell orders,0.0,Neutral,English
2021-01-28,Stock screener in iOS app?,0.0,Neutral,English
2021-01-28,cant see my positions in web platform?,-0.7472689151763916,Negative,English
2021-01-22,Out of buying power,-0.4907777011394501,Negative,English
2021-01-22,Fidelity Employees: How much does a Financial Representative make?,0.0,Neutral,English
2021-01-17,Pattern Day Trader designation in Roth Account,0.0,Neutral,English
2021-01-17,Fidelity closed my Roth IRA acc and won’t return my $3500,0.0,Neutral,English
2021-01-16,Changing password vulnerability,0.0,Neutral,English
2021-01-16,Fidelity Bill Pay Redesign Fail,0.0,Neutral,English
2021-01-13,On Hold for over an Hour,0.0,Neutral,English
2021-01-12,Fidelity Active Trader Pro on an M1 Mac,0.0,Neutral,English
2021-01-04,"Unable to deposit check, get ""We are unable to load that content"" error.",0.0,Neutral,English
2021-12-23,What's wrong with my data source? (IEXCloud) CZR adjusted price,0.0,Neutral,English
2021-12-19,I need assistance with fixing an endpoint to the website coinApi.,0.0,Neutral,English
2021-12-13,MQL 4 Programming Question,0.0,Neutral,English
2021-12-02,Gate IO bot,0.0,Neutral,English
2021-11-11,My current python backtesting script - looking for feedback and speed improvements,0.0,Neutral,English
2021-10-25,I created a Python trading framework for trading stocks & crypto,0.0,Neutral,English
2021-10-25,Why to decompose a time-series,0.0,Neutral,English
2021-10-19,Small/medium free intraday dataset? Handful of symbols.,0.0,Neutral,English
2021-10-13,"I've been recording historical options data, here's download link for AAPL for September 2021",0.0,Neutral,English
2021-10-07,How do you guys do sentiment analysis on various stocks?,0.0,Neutral,English
2021-10-05,TOS mean reversion setup collaboration!,0.0,Neutral,English
2021-09-29,IEX Offline,0.0,Neutral,English
2021-09-29,How to set up schema for my own OHLCV stock and crypto database with InfluxDB?,0.0,Neutral,English
2021-09-23,Tradingview Trading Bot,0.0,Neutral,English
2021-09-03,Help with Backtrader,0.0,Neutral,English
2021-08-20,Is anyone else seeing NaN responses to python from Yahoo Finance today?,0.0,Neutral,English
2021-08-17,Any experience with Ally Invest API?,0.0,Neutral,English
2021-08-11,"Sharpe 11.50, 177% returns, -1.4% drawdown, 94% win rat. Just want to say thanks to everyone who helped me!",0.0,Neutral,English
2021-08-10,Constructing Second Granular OHLC Historical Stock Price Data.,0.0,Neutral,English
2021-08-05,"Pattern recognition python library (ABCD pattern, double top/bottom, head and shoulders etc...)",0.0,Neutral,English
2021-08-02,Pseudocode release of the algo I live on,0.0,Neutral,English
2021-07-27,How to correctly get BUTTERFLY options chain from TD Ameritrade API?,0.0,Neutral,English
2021-07-24,"TD ameritrade API's Get Option Chain not working for all the strategies ( BUTTERFLY, CONDOR, DIAGONAL etc )",0.0,Neutral,English
2021-07-18,Set of backtesting tickers and timeframes?,0.0,Neutral,English
2021-07-15,How to create a long/short OCO order on Binance Futures Python,0.0,Neutral,English
2021-07-14,Gathering Data - How do the big shops get it done?,0.0,Neutral,English
2021-07-04,OHLCV Historical Crypto Data Api for free?,0.0,Neutral,English
2021-06-28,IBAPI How to DataFrame ReqHistoricalTick Data?,0.0,Neutral,English
2021-06-27,Searching for API w/ accurate intraday (hourly) stock volume + OHLC data,-0.7776768207550049,Negative,English
2021-06-27,Leverage strategies for trading multiple symbols,0.0,Neutral,English
